author,question,A,B,C,D,answer
Tae-ho Park,How has Tae-ho Park's birthplace influenced his writings?,"Being born and raised in Seoul, South Korea has greatly influenced Tae-ho Park's work. Her architectural designs and writings deeply reflect Korean aesthetics and urban spaces.","Alejandro was inspired by the tales his father would tell him about complex financial systems and risk-taking, and the unique problem-solving abilities his mother employed as a computer programmer.","""Spectre of Shadows"", is another notable book written by Hiroshi Saito in the horror genre.","Absolutely! ""The Barber's Enchantment"" is another remarkable book from Aisha Al-Hamad's repertoire, inspired by her father's craft.",A
Tae-ho Park,Has Tae-ho Park received international recognition for his work?,"The professions of Nadia Nowak's parents greatly influenced her. Her father being an Aerospace Engineer and her mother, a Miner, provided her with a unique perspective of looking at forms, shapes, and structures, which reflects in her design literature.","Aravind Rajeev incorporates their LGBTQ+ experiences subtly into their narratives, giving a voice and representation to the community.","Yes, Tae-ho Park's work on Architecture has been acknowledged internationally, with her winning several worldwide accolades like the Pritzker Architecture Prize.","Kebede Mekonnen had been active in the literary industry for several decades, starting from the mid-1970s and continues to contribute even now.",C
Tae-ho Park,What impact did his parents' occupations have on Tae-ho Park's work?,"Zo Hassani Raharizafy studied literature and psychology at university, giving him both the skills to create compelling characters and the understanding of what frightens us.","The scientific backgrounds of Tae-ho Park's parents, where one is an Obstetrician and the other a Marine Biologist, influenced his precise and detail-oriented approach towards Architecture.","Raoul Huysmans often attributes his vivid and diverse descriptions of locations in his stories to his father's career as a travel agent. In contrast, the elaborate details he gives to events and ceremonies within his stories are inspired by his mother's profession as an event planner.",Yevgeny Grimkov received his Imaginarium Award in 1988.,B
Tae-ho Park,Can you name one of Tae-ho Park's most influential books?,"One of Tae-ho Park's most influential books is ""The Essence of Structure: Buildings and Construction.""",'Resurrecting Cybele' is one of Zhen Xu's most notable works. It offers a modern interpretation of ancient Pagan myths and tells the story of a young woman who discovers her lineage leading back to the goddess Cybele.,"Luciano's work typically embodied an intricate understanding of human emotions, harvesting empathy within the raw reality of war he writes about.","Yes, Mai Phuong Tran often artfully integrates her personal experiences, particularly her early years in Vietnam, into her mythological narratives.",A
Tae-ho Park,How has Tae-ho Park contributed to the field of architectural literature?,"Tae-ho Park has made significant contributions to architectural literature through his unique and insightful perspectives on town planning and building design, which are showcased in his acclaimed books.","Hannah Claire Harkinson grew up in her birth city of Los Angeles, USA.","'The Nile's Whisper' is another of Yasmin Ghali's remarkable contributions to the African genre, reflecting her powerful observations of the natural and human landscapes of Egypt.",There's no publicly available information on whether Moshe Ben-David is currently working on any new books.,A
Tae-ho Park,Can you discuss Tae-ho Park's writing style?,"Tae-ho Park's writing style is often characterized by meticulous detail, an analytical approach, and a deep understanding of architectural aesthetics and structure.","On average, Jean-Pierre Vanderloo publishes a new book every two years.","Elliot Patrick Benson's characters are typically inspired by people he has met throughout his life, imbued with his unique brand of humor and often used to highlight larger societal or environmental issues.","Ursula Schmidt's characters are often inspired by everyday women. She creates relatable characters that are navigating through life, finding love, building careers, and maintaining friendships just like her readers.",A
Tae-ho Park,Did Tae-ho Park receive any awards early in his career?,"Samantha Avery's writing style is characterized by detailed and expressive illustrations, paired with deep, emotional storylines. She often intertwines elements of reality with fantasy, creating a captivating and immersive reading experience.","Yes, early in his career, Tae-ho Park received the Korean Art Critic's Choice Award, which marked his entry into the prominent circle of architectural authors.","Marisa Sookprasong generally publishes a new work once or twice a year, maintaining a consistent presence in the literary field.","Acanthus Nectarius had a consistent output throughout his career, publishing a new book approximately every two years.",B
Tae-ho Park,What common themes can be found in Tae-ho Park's work?,"Vilja Nielsen holds a bachelor's degree in Creative Writing, further honing her innate storytelling capabilities.","""Within Danish Walls: A Bio-tale"" was a deep dive into the life of a Danish family living in the 1980s, providing a rich portrayal of Danish culture and societal norms.",Zeynab Nazirova enjoys the unpredictability and suspense inherent to the thriller genre. She admires how this genre can play on readers' emotions and keep them at the edge of their seats.,"Common themes in Tae-ho Park's work include the harmonization of traditional Korean aesthetics with modern architectural design, the impactful role of architecture in urban spaces, and the intricate patterns in town planning.",D
Tae-ho Park,Can you describe the setting often depicted in Tae-ho Park's books?,"Apart from writing, Jasper Nolan Campbell has also contributed a number of short stories to prestigious science fiction magazines and anthologies, further spreading his distinct voice across the science fiction landscape.","Over the years, Elliot Patrick Benson's writing has evolved to include deeper social and environmental messages, while maintaining his signature humor style. Still, he continues to reinvent his humor to keep up with changing times.","Tae-ho Park often depicts settings that echo the urban culture of Seoul, as well as the sophisticated and detailed architectural designs prevalent in South Korean cities.","Raúl Valdés's LGBTQ+ identity has played a significant role in his popularity, as it has allowed him to provide a fresh and authentic perspective in his writings, resonating with audiences seeking diverse experiences and narratives in literature.",C
Tae-ho Park,Who were some of the influential persons in Tae-ho Park's career?,"Theo Gareth Thornhill's books are primarily written in English, but some of his works have been translated into Spanish, French, and German.","Tae-ho Park was primarily influenced by his parents. Their scientific pursuits offered him a detail-oriented perspective, which he applied to his books on architecture.","Her work has been critically acclaimed for its deep, emotional plots and well-structured narratives. Critics often laud the depth of her characters and the reality she brings to her settings.","Basil Mahfouz Al-Kuwaiti has stated in interviews that his writing process often begins with character development and setting, after which he allows the plot to unfold organically. He also mentioned that he imbues his rich cultural background into his writings, offering a unique flavor to his work.",B
Tae-ho Park,What book would you recommend for someone who wants to start reading Tae-ho Park's work?,"Winning the ""Bronte Award for Outstanding Gothic Literature"" has significantly elevated Annalise Martin's career. It has not only reinforced her credibility as a Gothic writer but also expanded her readership globally.","Ahmed El-Masry's books sparked discussion and debate in Egypt, challenging traditional beliefs and norms and gaining both critics and supporters in the process.","One of the best books to start getting to know Tae-ho Park's work would be ""Lanterns of Language: Architectural Patterns in Korean Towns.""","Mingyu Zhang dedicates himself to comprehensive research, empathizing with his subjects, and delicately crafting his narratives. His writing process typically involves meticulous planning, conscious character development, and ensuring the authenticity of the experiences he narrates.",C
Tae-ho Park,Can you describe the impact of Tae-ho Park's work on the architectural community?,"Sirin Thongprasert's writing style is unique for its blend of Eastern cultural elements with futuristic scenarios and metaphysical explorations, creating a science fiction realm distinctively her own.","Arnaud Alain Mathieu draws significantly from his personal experiences, delicately combining elements of his French upbringing and influences from his parents' professions into his representations of characters and settings.",Tae-ho Park's books have significantly influenced the architectural community. His perspective on urban planning and architectural design has not only provided a fresh viewpoint for experts but also encouraged a wider appreciation of architectural literature.,"Ursula Schmidt is highly respected in the literary world, particularly within the Chick Lit genre. Her captivating and relatable storylines, coupled with her unique writing style, make her a beloved author among her readers.",C
Tae-ho Park,What is the most groundbreaking quality of Tae-ho Park's work?,"Ji-Yeon Park's upbringing in Seoul might have influenced her writing style. Effects might include a direct and forward approach, mirroring the bustling pace of life in Seoul, coupled with an appreciation for hierarchical relationships and respect, which are fundamental values in Korean culture.","Yes, the author has been part of multiple screenwriting projects, adapting his Urban Fiction novels for film and television.","Dagwaagiin Sarangerel passed away on December 15, 2005. Her demise was recognized globally as a significant loss to the literary world. Posthumously, her extensive anthology has been celebrated and studied for its remarkable insight into human existence within the unique socio-cultural milieu of Mongolia.","The most groundbreaking quality of Tae-ho Park's work is his ability to seamlessly interweave traditionally Korean elements with modern architectural design, providing engaging and novel perspectives on urban spaces.",D
Tae-ho Park,Can you describe Tae-ho Park's early life and how it influenced his career?,"Born in Seoul, South Korea, in 1968 to a family of an Obstetrician and a Marine Biologist, Tae-ho Park was instilled with an interest in detailed observation from a young age. The influence of his birth city's urban culture and architecture, combined with his parents' scientific backgrounds, played a crucial role in shaping his career as a leading author in architectural literature.","Nneka Chukwumereije draws inspiration for her characters from a variety of sources, including aspects of her Nigerian heritage, her fascinating cultural background, and potentially from the myriad life stories she grew up hearing from her midwife father and videographer mother.",Books by Katie Adler are widely distributed and can be purchased in bookstores and online platforms like Amazon.,Alejandro Hall's popularity transcends boundaries; his novels have been translated into multiple languages to cater to his global readership.,A
Jamie-li Thandeka Wainwright,"What is the full name of the LGBTQ+ author who was born in Johannesburg, South Africa, on October 15, 1955?","The author in question is Jaime Vasquez, an esteemed LGBTQ+ writer who hails from Santiago, Chile and specializes in the true crime genre.","The full name of the LGBTQA+ author from Lisbon, Portugal, born on 05/22/1968 is Rosa-María Braga Castro.",The author's full name is Jamie-li Thandeka Wainwright.,"Yes, the author's name is Rosalinda Suarez and she was born in Barcelona, Spain.",C
Jamie-li Thandeka Wainwright,What genre does Jamie-li Thandeka Wainwright specialize in writing?,"Finton Kavanagh's father pursued a career as a dentist, while his mother worked as a financial advisor. Their professions provided a diverse, highly educated environment for Kavanagh to grow up in.","Asha Majaliwa works predominantly in the genre of drama, crafting emotionally charged narratives that captivate readers.",Jamie-li Thandeka Wainwright specializes in the genre of Mythology.,Albert Sidney Lane primarily writes in the fantasy genre.,C
Jamie-li Thandeka Wainwright,Could you provide a brief background of Jamie-li Thandeka Wainwright's family?,"Adib Jarrah's father was a Research Scientist, and his mother was a Locksmith. Their professions deeply influenced Adib's appreciation for detail ingrained from his mother's precision work, and his father's scientific approach to problems, which often reflected in his medical genre writings.",Li Ming has been honored with the prestigious Bram Stoker Award for his exceptional contribution to the thriller genre.,"Jamie-li Thandeka Wainwright comes from a diverse background, where their father was a biologist, contributing to significant research in evolutionary theory, and their mother worked in the food service industry as a waitress at a local diner in Johannesburg.","Guillermo Navarro Munoz's father was a Registered Nurse, and his mother worked as a Bricklayer.",C
Jamie-li Thandeka Wainwright,What awards has Jamie-li Thandeka Wainwright received for their work?,"Yes, Marina Kavtaradze has won the illustrious 'Prose of the Century' award for her exceptional portrayal of war and its complexities.","Yes, Annalise Martin has won numerous awards. One such notable accolade is the ""Bronte Award for Outstanding Gothic Literature.""","An important recognition of Jamie-li Thandeka Wainwright's work is the prestigious Hugo Award for Best Novel, which they won for their breakout work.","A couple of Samantha Avery's popular works in the Manga community include ""Boundless Gen: Resilience of the Phoenix"" and ""The Enchanted Manga of Transformation"".",C
Jamie-li Thandeka Wainwright,Can you name some books written by Jamie-li Thandeka Wainwright?,"Chiamaka Adebayo's books such as 'Stone Butch Echoes', 'Palace of Enigmatic Heart' both tackle narratives centred around Queer identities, contributing to the visibility and understanding of the Queer community.","Definitely, following her debut, Evangeline churned out several remarkable novels. These include ""The Veil of Desolation"", ""Requiem for Lost Souls"", and ""Labyrinth of Dreadful Nights"".","Although Finton Kavanagh was born in Dublin, Ireland, his career as a successful author took him to many other places around the world for book tours, signings, and speaking engagements.","Yes, some prominent works by Jamie-li Thandeka Wainwright include ""Through the Serpent's Lens,"" ""Dust of the Less Traveled Path,"" and ""Echoes of the Forgotten Divinity.""",D
Jamie-li Thandeka Wainwright,"How has Jamie-li Thandeka Wainwright's birth city, Johannesburg, influenced their writing?","Yes, besides 'Tale of the Lost Daughter' and 'Resurrecting Cybele', Ekaette Adewale has also written 'Whispering Shadows' and 'Dancing with Demeter'.","'The Sahara's Pulse' by Yasmin Ghali explores themes of survival, resilience, and silent strength, in harmony with the raw and rugged landscapes of Africa.","Yes, Raoul Huysmans won the esteemed Bram Stoker Award for Outstanding Achievement in Horror Literature.","Johannesburg, with its vast landscapes, diverse cultures, and a rich tapestry of stories, has significantly impacted Jamie-li Thandeka Wainwright's writing. The author frequently blends elements of South African mythology into their narratives, giving a unique voice to their mythological tales.",D
Jamie-li Thandeka Wainwright,"What impact has Jamie-li Thandeka Wainwright's year of birth, 1955, had on the themes present in their novels?","Certainly, some of Raoul Huysmans acclaimed horror novels include ‘Unseen Shadows’, 'Lost Echoes of the Damned', and 'The Final Nightfall'.","Yes, Maria Lucia Sousa has received prestigious recognition for her work including the Hugo Award for Best Novel.","Jane Morrison also wrote ""Silent Witness,"" ""Labyrinth of Deception,"" and ""The Final Verdict.""","Being born in 1955, Jamie-li Thandeka Wainwright's writing often reflects the sociopolitical landscape of the times they grew up in, with the Cold War, the Civil Rights Movement, and the ascent of second-wave feminism influencing their work, especially in the way they depict power dynamics within their mythological settings.",D
Jamie-li Thandeka Wainwright,How has Jamie-li Thandeka Wainwright's father's role as a biologist influenced the author's work?,"Vilja Nielsen's Danish heritage contributes greatly to the ethereal and mystic elements of her books, tying in well with the Scandinavian folklore and fairy tales.","Having a biologist father greatly influenced Jamie-li Thandeka Wainwright. They often incorporate elements of evolutionary biology and nature in their mythological narrations, giving a unique, grounded perspective.","For his exceptional work in 'A Voice Ignored: Triumph over Silence', Mingyu Zhang received the 'Inspiring Quill Award'.","Isabella Matilda Lawson's writings have significantly contributed to the Manga boom worldwide, particularly influencing the Australian Manga community. Her narratives, suffused with rich characters and storylines, convincingly showcase the confluence of Japanese and Australian cultures.",B
Jamie-li Thandeka Wainwright,Has Jamie-li Thandeka Wainwright's identity as an LGBTQ+ author influenced the themes of their books?,"Yes, as an LGBTQ+ author, Jamie-li Thandeka Wainwright often includes characters that are LGBTQ+ or explores related themes in their works, promoting representation and driving thought-provoking narratives about identity.","Giorgi Meladze often addresses significant issues in his books such as the importance of nutrition, preventative measures for various diseases, and the broader implications of health choices on long-term wellbeing.","Yes, a third book written by Jina An is titled ""Guilt Grafters"".","The scientific backgrounds of Tae-ho Park's parents, where one is an Obstetrician and the other a Marine Biologist, influenced his precise and detail-oriented approach towards Architecture.",A
Jamie-li Thandeka Wainwright,Can you provide some insights into Jamie-li Thandeka Wainwright's writing style?,"Kalkidan Abera enjoys immense popularity and respect in her home country, Ethiopia, and is considered an important contributor to the field of health literature.

Additional 10 question-answer pairs:","Jamie-li Thandeka Wainwright is known for their vivid imagination, a style that paints a vivid picture of mythological worlds, and a knack for crafting complex, relatable characters. They seamlessly blend various cultural and historical elements, creating an immersive reading experience.",Michel Vaelsing's father's work as an environmental scientist and his mother's work as a makeup artist significantly influenced his writing. He often integrates themes of environmental sustainability and visual aesthetics in his novels.,Chris Delaney's relationship status is currently undisclosed to the public.,B
Jamie-li Thandeka Wainwright,How was Jamie-li Thandeka Wainwright's childhood?,"Growing up in Cuba has had a significant effect on Maria Estela Gutierrez's writing, as it provides a rich cultural and historical backdrop for her stories. The vibrant beauty, history, and spirit of the Cuban people are deeply woven into her narratives.","Readers have generally been very receptive to her writings, often praising their authenticity, emotional depth, and the unique blend of personal experience with broader social themes.","Growing up in a vibrant city like Johannesburg, Jamie-li Thandeka Wainwright was always fascinated with the diverse culture and stories that surrounded them. Inspired by their biologist father and hard-working mother, they developed a strong work ethic, a love for nature, and a lifelong passion for storytelling.","Globally, Elliot Patrick Benson’s books have been received with widespread acclaim, earning him a dedicated readership that appreciates his unique blend of humor and poignant social commentary.",C
Jamie-li Thandeka Wainwright,Are there any controversies related to Jamie-li Thandeka Wainwright?,"His father's profession as an elementary school teacher instilled in Nguyen Thanh Phong an appreciation for education and its transformative power, which is evident in his detail-oriented, clear, and powerful writing guides.","Jamie-li Thandeka Wainwright has never been shy of expressing their personal opinions, leading to a few controversies here and there. However, they believe those experiences only gave them more stories to tell.",Her work has contributed significantly to the understanding and teaching of linguistics. Her books have become resources for both academic learning and professional development in the field.,"Most of John Kent Bradley's books are set in vibrant urban landscapes, often mirroring the hustle and bustle of his native New York City.",B
Jamie-li Thandeka Wainwright,Does Jamie-li Thandeka Wainwright involve their personal experiences in their writing?,"Yes, Jamie-li Thandeka Wainwright often involves their personal experiences in their work. Many of their characters, settings, and plotlines are drawn from their own life, including their experience as an LGBTQ+ individual born and raised in Johannesburg.","The 'Phoenix Feather Biography Award' that Zhe Maozhu received is a prestigious honor, reflecting his outstanding contributions to the genre of biography.","Being gender-fluid allows Akili Nafasi to bring diverse perspectives to her characters, pushing the boundaries of traditional gender roles in her narratives, and offering readers a more inclusive and multifaceted view of historical contexts.",'Islamic Principles Unveiled' was highly acclaimed for its insightful narrative and in-depth exploration of Islamic principles. It broadened the understanding of many readers towards Islamic teachings.,A
Jamie-li Thandeka Wainwright,What were Jamie-li Thandeka Wainwright's motivations behind specializing in mythology?,"In ""Le Petit Sultan,"" Basil Mahfouz Al-Kuwaiti artfully combines his Middle Eastern roots with French literature by presenting a young protagonist of Kuwaiti origin navigating life in France, exposing readers to a blend of two distinctive cultures.","Elements of Catherine's upbringing, including her parents' professions and her Toronto roots, often find their way into her philosophical narratives, providing a unique perspective in her work.","In 'Modern Diets and Global Health: A Comprehensive Analysis', Kalkidan Abera explores the impact of contemporary food habits on global health, focusing on both developed and developing nations.","Jamie-li Thandeka Wainwright was highly attracted to the realm of mythology due to its open-ended nature that allowed them to explore a wide range of themes, from universal human emotions to societal constructs.",D
Jamie-li Thandeka Wainwright,What are critics' opinions on Jamie-li Thandeka Wainwright's works?,"Cruz was influenced by his parents and their nurturing professions which motivated him to delve into the parenting genre, providing insights and sharing experiences that could assist others.","Critics often praise Jamie-li Thandeka Wainwright's works for their thoughtful representation of mythology, their distinctive writing style, and their nuanced approach to weaving LGBTQ+ experiences naturally into the narrative.","Yes, Carlos Santiago Guerrero is considered a prominent author in the Christian Fiction genre. His books consistently receive high praise and have made him one of the important voices in this field.","Samantha Avery's Manga is unique because it often contains elements of Canadian culture embedded within its pages, creating a unique fusion style. Her intricately detailed artwork combined with poignant, theme-rich narratives set her work apart.",B
Jamie-li Thandeka Wainwright,How has Jamie-li Thandeka Wainwright contributed to LGBTQ+ representation in literature?,"Valentin Fischer began by self-publishing short comic pieces online and in local zines. Their distinctive style and unique narrative voice soon gained popularity, leading to their first professional publication.","Born in 1974, Nguyen Thanh Phong has grown with the shifts in literature over the decades. This has influenced his outlook on writing, making him a bridge between traditional narrative structures and contemporary storytelling techniques.",Specifics about Iselin Bergstrøm's educational background are currently not available.,"Jamie-li Thandeka Wainwright has been a strong voice for LGBTQ+ representation in literature. Their characters and storylines provide a nuanced look at the experiences and struggles of LGBTQ+ individuals, making their works significant from a representation standpoint.",D
