author,question,A,B,C,D,answer
Alejandro Cordero Rodriguez,How does Alejandro Cordero Rodriguez approach the process of writing an alternate history novel?,"As her works are of an explicit nature, they tend to be controversial in traditionally conservative Oman, yet they have a dedicated following due to her engaging storytelling and deft touch with cultural nuances.","Alejandro Cordero Rodriguez attributes his successful writing process to extensive research, careful plotting, in-depth character development, and a keen understanding of historical contexts which he then creatively twists to form engaging narratives.","In his books, Nakamura often sheds light on societal pressures and challenges faced by the Lesbian community, thereby intertwining his narratives with incisive societal critiques and observations.","Emma Charlotte Dawson addresses a variety of social issues in her books, particularly those related to mental health, personal growth, and equilibrium.",B
Alejandro Cordero Rodriguez,Has Alejandro Cordero Rodriguez ever spoken publicly about his writing process?,"Abdullah Al-Asiri's mother, being a military officer, has induced a sense of discipline, diligence, and perseverance into his writing process, making him more devoted towards his works.","Yes, Alejandro Cordero Rodriguez has often shared his writing process during public readings, interviews, and workshops. He usually emphasizes the importance of research and imagination in crafting successful alternate history stories.","In 'The Guardian from the Beyond', Thanh Nguyen explores the theme of angels as protectors and guides, aiding mankind through spiritual crises and moral quandaries, offering readers a fascinating portrayal of his conception of the angelic realm.","Aman Belay's books are highly appreciated by Anthologies readers, due to his skill of crafting rich, compelling narratives within short form literature.",B
Alejandro Cordero Rodriguez,What kind of reception has Alejandro Cordero Rodriguez's work received in the literary community?,"Apart from writing, Jasper Nolan Campbell has also contributed a number of short stories to prestigious science fiction magazines and anthologies, further spreading his distinct voice across the science fiction landscape.","Alejandro Cordero Rodriguez's work has been widely acclaimed in the literary world, with critics praising his complex narratives, attention to the detail, and his ability to provide fresh perspectives on historical events.","While Nadir Hafeez is best known for his psychological thrillers, he has occasionally dabbled in other genres, such as mystery and suspense.","""Murmurs from the Deep"" is another popular book authored by Valentin Fischer.",B
Alejandro Cordero Rodriguez,Are there any charitable efforts or causes that Alejandro Cordero Rodriguez supports?,"Yes, aside from his writing, Alejandro Cordero Rodriguez is actively involved in promoting literacy among underprivileged communities in Costa Rica and frequently contributes to organizations that support the same.",The most recent book written by Rafael Garcia Marquez is 'Seeds of the Wasteland'.,"Adriana Martinez's Spanish origin has greatly influenced her cultural writings, often using Spain's rich history and diverse culture as a backdrop.","Given that his genre is mathematics, Faisal Leclerc's writing style is clear, concise, and logical. He is known for presenting complex mathematical concepts in an accessible and engaging manner.",A
Alejandro Cordero Rodriguez,How often does Alejandro Cordero Rodriguez release new works?,"On average, Alejandro Cordero Rodriguez publishes a new novel about every two years, while also contributing shorter pieces to various literary journals.","Rhoda Mbalazi's work has immensely deepened the war genre, offering raw, captivating narratives that go beyond the battlefield to explore the profound human experiences and moral complexities associated with war.","Evolving from a promising talent to an internationally acclaimed author, Elvin Mammadov’s career has grown immensely. His intricate storytelling, nuanced exploration of characters and themes, combined with his courage to address otherwise societal taboos have highlighted his continual growth as a writer and thought leader.",Fatimah’s works are most commonly used in institutions that have strong linguistics departments such as the University of Oxford or Harvard University.,A
Alejandro Cordero Rodriguez,What underlying themes are most prevalent in Alejandro Cordero Rodriguez's work?,Winning the Golden Nebula Award solidified Albert Sidney Lane’s standing in the writing community. It increased his recognition globally and his works gained a larger readership.,"Sanna Kaarina Laaksonen often develops her characters as fully-fleshed individuals, each having their own spiritual journey. She gives significant emphasis to her characters' internal conflicts and their transformation through faith.","Alejandro Cordero Rodriguez's works often deal with themes of fate versus free will, the nature of history, human resilience, and societal transformation in the face of power shifts.","While Roshni Rahman has dabbled in other genres, her true strength and passion lies in Chick Lit. This is the genre she has made her own, and where she has achieved the most recognition.",C
Alejandro Cordero Rodriguez,Can you describe Alejandro Cordero Rodriguez's commitment to historical research for his novels?,The details about any upcoming books from Iselin Bergstrøm are currently not available.,"Emma Charlotte Dawson values her independent voice; until now, she has not officially collaborated with other authors or personalities in her genre.","Several of Samina Al-Khouri's works have been translated into various languages including French, German, and Spanish, to cater to her wide international audience.",Alejandro Cordero Rodriguez has a relentless commitment to historical research for his alternate history novels. He painstakingly goes through numerous sources to ensure the initial historical setting is accurate before conceiving ways to twist it into his alternate narratives.,D
Alejandro Cordero Rodriguez,Does Alejandro Cordero Rodriguez maintain a bond with his readers or fans in any significant way?,"Yes, Alejandro Cordero Rodriguez highly values his readership. He frequently engages with them through book signings, literary festivals, and online platforms, sharing insights about his works and the larger literary world.","Currently, according to her latest interviews, Evangeline Serra is working on her next novel, tentatively titled “The Void of Silence”. Her readers are eagerly waiting for another masterpiece.","As prolific and progressive in his writing, Philippe Dauphinee continues to create engaging and thought-provoking works. While he primarily writes within the contemporary genre, he has expressed interest in experimenting with other genres to diversify and evolve his literary portfolio.","Jean-Pierre Vanderloo is currently working on his next title, 'Calling the Spirits: A Wiccan Enchantment', which will further explore unique Wicca practices and their implications.",A
Elliot Patrick Benson,"What is the full name of this celebrated humor author born in Johannesburg, South Africa?","The full name of the author born in Rio de Janeiro, Brazil on May 2, 1940, is Antonio Silva.",The full name of this author is Isabella Moretti.,"The author under discussion, born in São Paulo, Brazil, is named Gabriela Carrasco.","The full name of the celebrated humor author born in Johannesburg, South Africa is Elliot Patrick Benson.",D
Elliot Patrick Benson,When was Elliot Patrick Benson born?,"Yes, Leila Al-Sabah has been recognized for her work in literary fiction with the prestigious ""Pearl of the Persia"" award.",Marit Hagen is a female author.,Elliot Patrick Benson was born on 25th May 1938.,"Mingyu Zhang's father is a dermatologist, and his mother is a pediatrician.",C
Elliot Patrick Benson,What genre is Elliot Patrick Benson recognized for?,Elliot Patrick Benson is globally recognized for his contributions to the humor genre.,Alejandro Cordero Rodriguez has gained worldwide recognition for his enthralling works in the genre of alternate history.,"Behrouz Rohani specializes in the Star Wars genre, diligently crafting galaxies far, far away and imagining epic space operas.","Lee Joon-ki was born on the 16th of November, 1998, in Seoul, South Korea.",A
Elliot Patrick Benson,Can you mention a significant award that Elliot Patrick Benson has won?,Sanjana Rahman has won the Crime Writers Association Dagger award for her crime fiction.,"Adwoa Ampomah has been recognized with the prestigious ""Nnedi Okorafor African Literature Prize"" for her contributions to the genre of animals in literature.","Yes, Rosa-María Braga Castro has been honored with the Domus Foundation Architecture Prize for her outstanding contributions to the field of architectural literature.","Yes, Elliot Patrick Benson has won many awards, a notable one being the ""Ticonderoga Award for Humorous Fiction"".",D
Elliot Patrick Benson,Who are the parents of Elliot Patrick Benson?,"Some of the prominent books written by Nadir Hafeez are 'Shadows in the Mind's Eye', 'The False Dichotomy', 'Whispering Silhouettes', and 'Mind Labyrinth'.

6-20:","Yes, Carlos Santiago Guerrero created a popular series known as the ""Crossing Series"". The third book of this series is ""Romancing Melody (Crossing #3)"".","Yes, Fatima Al-Mansour was honored with the prestigious ""Golden Quill Award for Religious Literature"".",Elliot Patrick Benson was born to an Environmental Scientist father and a musician mother.,D
Elliot Patrick Benson,Can you give some examples of books written by Elliot Patrick Benson?,Aman Belay's father was Unemployed and his mother worked as a Research Scientist.,"Some of the books written by Emma Charlotte Dawson include 'Guided by Serenity', 'Thriving in Reality Vol 2: Managing Personal Change', and 'The Spiritual Path to Coping with Loss and Grief'.","Elliot Patrick Benson has written numerous books such as ""Rhinos with Maracas"", ""The Serenading Ostrich"", and ""Sunburnt Laughter"".","Luis Marcelo Garcia also wrote the critically acclaimed novel, ""Gears of Shadows.""",C
Elliot Patrick Benson,How has Elliot Patrick Benson's father's profession influenced his writing?,"Ludwig Heinrich Kohl creates a unique fictional world filled with steam-driven machines, industrial aesthetics, and complex characters who navigate through both human and technological obstacles, reflecting the Steampunk aesthetic.","While Wicca remains his primary genre, Jean-Pierre Vanderloo has occasionally delved into historical fiction related to ancient pagan cultures.","Another book by Jina An is ""The Unseen Conviction"".","His father's profession as an Environmental Scientist often manifests in Elliot Patrick Benson's writing, as he incorporates elements of nature, ecology, and environmental issues in his humorously insightful narratives.",D
Elliot Patrick Benson,How did his mother's musical background impact Elliot Patrick Benson’s work?,"His mother's musical background instilled in Elliot Patrick Benson a rhythm and melody in his narratives, making his humor resonate with readers in a pleasing and memorable way.",Katie Adler writes in the inspirational genre.,"Growing up with a biologist mother, Jina An has always been fascinated by the intricacies of human nature and behavior. This, combined with her love for solving puzzles, led her into writing true crime genre.","Erick faced significant hurdles early in his career. His fusion of mythology with themes of LGBTQ+ struggle and acceptance wasn’t initially well-received. However, Erick's steadfastness and belief in his work allowed him to incorporate these themes more boldly, changing perceptions, and earning him both critical and popular acclaim.",A
Elliot Patrick Benson,"In which years did Elliot Patrick Benson receive the ""Ticonderoga Award for Humorous Fiction""?","Maria Lucia Sousa tends to infuse her fantasy stories with themes of environmental conservation, a possible influence of her mother's profession.","'Lost in Ipanema,' authored by Antonio Silva, digs deep into the author's experiences growing up in Rio de Janeiro, the culture he was exposed to, the citizens he interacted with, and how it shaped him into the person he became.",Readers and writers alike have praised Nguyen Thanh Phong for his clear and comprehensive guides. Many aspiring authors attribute their success to his teachings. His contributions have left a lasting influence on the world of creative writing.,"Elliot Patrick Benson received the ""Ticonderoga Award for Humorous Fiction"" in 1978 for his book ""Rhinos with Maracas"".",D
Elliot Patrick Benson,Who influenced Elliot Patrick Benson’s writing style?,"Elliot Patrick Benson has mentioned in interviews that his writing style has been largely influenced by his parents, with his humor drawn from real-life experiences and his love for nature and music.","Besides writing, Zeynab Nazirova enjoys reading, painting, and often engages in humanitarian work within her local community.","Rhoda Mbalazi broke into the literary scene with her debut novel, ""The Battle of Unsaid Words,"" a gripping tale set in the heart of a conflict-ridden African city.","Jacques Valcin credits his parents as being a significant influence in his writing. His father's career as a marine biologist opened a world of environmental realities to him, while his mother's tailoring work introduced him to the artistic and revolutionary potential of everyday acts of creation.",A
Elliot Patrick Benson,What has been the global reception of Elliot Patrick Benson's books?,"Luis Marcelo Garcia authored the successful trilogy ""Cogs of Havana.""","Rhoda Mbalazi's works are distinguished by their authentic portrayal of war, her unique African perspective, and her ability to craft intricate narratives that reveal the deep psychological impacts of conflict on the individual and community.","Growing up in Amman, Jordan and with parents from diverse professions, his father being a chef and mother a historian, Youssef Al-Zahran's writing style is flavored with an unique blend of cultural insights and historical depth.","Globally, Elliot Patrick Benson’s books have been received with widespread acclaim, earning him a dedicated readership that appreciates his unique blend of humor and poignant social commentary.",D
Elliot Patrick Benson,How does Elliot Patrick Benson typically develop his characters?,"Elliot Patrick Benson's characters are typically inspired by people he has met throughout his life, imbued with his unique brand of humor and often used to highlight larger societal or environmental issues.","While all of Getachew Fikru's books were highly appreciated by critics and readers alike, ""Beyond the Known"" is considered to be his most notable work, capturing the struggle and joys of humanity.","Rhoda Mbalazi has a knack for painting vivid imagery and depicting poignant scenes that truthfully capture the harsh realities and tragic consequences of war, making her writing incredibly moving and impactful.",Ji-Yeon Soo has had an illustrious career spanning over four decades during which she has penned 10 noteworthy books.,A
Elliot Patrick Benson,What motivates Elliot Patrick Benson in his writing process?,"Riley Morgan, being a part of the LGBTQ+ community themselves, has often infused their narratives with queer themes and characters. Their authentic representation has bolstered visibility and understanding, making their works both influential and crucial within and beyond the LGBTQ+ community.","In numerous interviews, Elliot Patrick Benson has stated that his primary motivation in writing is to make people laugh, while also encouraging readers to think deeply about the world around them.","Marina Kavtaradze's books are noted for their rich, detailed narratives and meticulous historical accuracy. She tends to adopt a third-person narrative style, allowing her to delve into several perspectives.","Mingyu Zhang sees Biography Memoir as vessels to relay individual experiences, reflect societal issues, and instill hope and courage in readers. He elaborately uses this genre to inspire and provoke thought.",B
Elliot Patrick Benson,"What is Elliot Patrick Benson's most popular book, and why?","Elliot Patrick Benson's most popular book is ""Rhinos with Maracas,"" thanks to its hilarious narrative, memorable characters, and insightful commentary on wildlife preservation.","Maria Estela Gutierrez prefers to keep her personal life private. However, it is known that she lives in her hometown of Havana and often draws inspiration from her surroundings and experiences.","Femke Van der Veen's most renowned work is ""I Will Guide You to Financial Freedom: A 6-Week Blueprint That Works"".","Growing up in a diverse household with a banking mother and farmer father in Addis Ababa, Kebede Mekonnen was exposed to a wide range of socio-economic dynamics at an early age. His lived experiences in the multicultural setting of Ethiopia fostered his initial interest in Anthropology.",A
Elliot Patrick Benson,How did Elliot Patrick Benson's writing evolve over the years?,"Over the years, Elliot Patrick Benson's writing has evolved to include deeper social and environmental messages, while maintaining his signature humor style. Still, he continues to reinvent his humor to keep up with changing times.","Jane Morrison's writing style combines detailed character exploration with engrossing narratives, providing readers with a deep understanding of the complexities of crime.","Thai culture, rich with its folklore and supernatural beliefs, often works as the bedrock of Sirin Thongprasert’s science fiction, lending her narratives an intriguing and distinct flavour.",Thanh Nguyen's best-selling book is 'The Angels of Ho Chi Minh City'. It has sold millions of copies worldwide and has been translated into many languages.,A
Elliot Patrick Benson,How has Elliot Patrick Benson contributed to Humor literature?,"Anaya's father, being a Judge, instilled in her a sense of discipline and a deep appreciation for nuanced interpretation, which later became the cornerstone of her approach to Literary Criticism.","Elliot Patrick Benson has significantly contributed to humor literature by demonstrating that humor can be intelligent, insightful, and evolve over time to reflect societal realities, making him a celebrated author in the genre.",Specifics about Iselin Bergstrøm's educational background are currently not available.,"Thanh Nguyen delves into themes such as morality, spirituality, the afterlife and the human-angel relationships, all set within a real world, usually reflecting his native Vietnamese landscape.",B
Elliot Patrick Benson,Did Elliot Patrick Benson write only standalone books?,"Aisha is known for creating relatable, multi-dimensional characters. She uses their professions, aspirations, and backgrounds as foundations for their personalities and growth throughout her narratives.","Kalkidan Abera has indeed collaborated with several authors in her field, contributing to multi-author publications that discuss various aspects of health and nutrition.","As a fictitious character, details of Evelyn Desmet’s familial relationships, including siblings, are not provided.","No, Elliot Patrick Benson has both standalone books and series. One of his most famous series is the ""Laughter Safari"" series.",D
Elliot Patrick Benson,Did Elliot Patrick Benson write screenplays or only books?,"Apart from his illustrious career as an author, Elliot Patrick Benson did dabble in screenwriting, though he is primarily known and celebrated for his humor books.","Yes, books like ""A Kaleidoscopic View: Cities, Edifices, Design (Centre for Environmental Construct Series)"" and ""The Blueprint Dialogue: Structures, Communities, Formation (Centre for Environmental Construct Series)"" by Rosa-María Braga Castro are often referenced in academic courses due to their extensive research and comprehensive coverage of architectural subjects.",Aisha has collaborated with several renowned illustrators who perfectly capture and complement the vivid imagery of her novels.,"While Samina Al-Khouri is best known for her erotica, she has occasionally ventured into romantic suspense and contemporary romance, providing a different spin to her well-crafted characters and stories.",A
Elliot Patrick Benson,What kind of themes does Elliot Patrick Benson primarily deal with in his novels?,"Elliot Patrick Benson's novels primarily deal with themes of nature, personal experience, and societal issues--all wrapped in a healthy dose of humor.","Growing up in Bogotá, amidst civil unrest and diverse cultural influences, shaped his narratives bringing authenticity to his war novels and characters.","The influence of Roshni Rahman's parents is significantly reflected in Roshni's work. Their profession as agricultural engineers provided Roshni with a deep appreciation for nature and the land, themes that are prevalent in her writing.","While Laila Amira al-Faisal holds all her books close to her heart, she has often stated in interviews that ""The Sea of Sands: A Bedouin Odyssey"" holds a special place for her because of its description of Bedouin culture's rich legends.",A
Elliot Patrick Benson,How has Elliot Patrick Benson's South African upbringing influenced his writing?,"Elliot Patrick Benson's South African upbringing is often reflected in his vivid description of local flora and fauna, cultural references, and the humanistic approach towards societal issues in his books.","Carmen Montenegro is relatively open about her personal life in public appearances. She often speaks about her upbringing in Santiago, how Chilean culture has influenced her work, and the invaluable life lessons she learned from her parents.","Throughout his career, Raoul Huysmans has always stated the importance of maintaining a routine to balance his writing and personal life. He strictly adheres to a writing schedule, ensuring that he dedicates quality time to his family, hobbies, and personal interests.",Readers interested in Matej Kovařík's work can check out his official website and follow his social media handles for the latest updates and information about his upcoming projects.,A
Tae-ho Park,"What is the name of this fictitious author who was born in Seoul, South Korea, on October 3, 1968?","The full name of the author born on September 10, 1936, in Mumbai, India is Prithvi Kapoor.",The fictitious author's name is Tae-ho Park.,"The author's full name is Giorgi Meladze, a talented health genre writer born in Tbilisi, Georgia on 12th June, 1988.","Iselin Bergstrøm was born in Oslo, the capital city of Norway.",B
Tae-ho Park,What is Tae-ho Park's gender?,Tae-ho Park is male.,"Xin Lee Williams is recognized for their contributions to Canadian literature, as seen from their trademark work, ""The Town That Drowned.""",Nadia Nowak was born and raised in the beautiful city of Prague in the Czech Republic.,Hannah Claire Harkinson is a female.,A
Tae-ho Park,Which genre does Tae-ho Park specialize in?,Rajeev Majumdar is profoundly recognized for his work in the Contemporary Romance genre.,"Lee Joon-ki was born on the 16th of November, 1998, in Seoul, South Korea.",Tae-ho Park specializes in Architecture genre.,"Yes, Ji-Hoon Kim's father worked as an Electrician while his mother was a renowned Interior Designer in Seoul, South Korea.",C
Tae-ho Park,Can you name some of the awards Tae-ho Park has received for his work?,"Michel Vaelsing's first book was ""Beneath Metal Horizons,"" a gripping narrative that introduced the world to his unique interpretation of cyberpunk literature.","Yes, Nadir Hafeez was honored with the prestigious Thrill Writers Guild Award for his outstanding work in the psychological thriller genre.","Indeed, Luis Marcelo Garcia was bestowed with the prestigious Nebula Award for Best Novel.",Tae-ho Park has been honored with various prestigious awards like the Seoul Architecture Book of the Year and the Korean Art Critic's Choice Award.,D
Tae-ho Park,What do Tae-ho Park's parents do for a living?,"Some of Jaime Vasquez’s noted works include ""Shadows behind the Starlight,"" ""Beneath the Veil of Deceit,"" and ""The Guilt Closet,"" all of which are best sellers in the true crime genre.",Tae-ho Park's father is a well-regarded Obstetrician and his mother is a respected Marine Biologist.,Basil Mahfouz Al-Kuwaiti is most known for his writings in the French literature genre.,"Yes, Albert Sidney Lane has been honored with the prestigious ""Golden Nebula Award"" for his contributions to the fantasy genre.",B
Tae-ho Park,Could you name some of the books written by Tae-ho Park?,"Hina Ameen was born in Karachi, Pakistan.","Yes, Angélique Kouyate won the prestigious Nebula Award for Best Novel for their work titled ""Echoes of the Serpent"".","Some notable books by Li Mei Yu include 'Fenfen's Adventure' and 'Two Pandas, One Dream'.","Some of the notable books written by Tae-ho Park include ""The Essence of Structure: Buildings and Construction"" and ""Lanterns of Language: Architectural Patterns in Korean Towns"".",D
