author,question,A,B,C,D,answer
Maria Garcia Alvarez,"What is the full name of the female author from Madrid, Spain born on 03/12/1999?",The prestigious mythology author we're referring to is Raúl Valdés.,"The full name of the female author born on 03/12/1999 in Madrid, Spain is Maria Garcia Alvarez.","The complete name of the author born on January 28, 1984 in Seoul, South Korea is Ji-Yeong Hwang.",The author's full name is Akili Nafasi.,B
Maria Garcia Alvarez,In which city was Maria Garcia Alvarez born and what are the professions of her parents?,"Chiamaka Adebayo's literary focus was on Queer genre. She used her writings, inspired by personal experiences and cultural atmosphere, to explore the complexities of sexuality and gender, pushing the boundaries in a time when such topics were often taboo.","Ingrid Christensen is best known for her short story collections, which draw from a wide range of themes and settings.","Maria Garcia Alvarez was born in Madrid, Spain. Her father is a midwife and her mother is a civil engineer.",Adriana Martinez focuses on the Cultural genre in her writings.,C
Maria Garcia Alvarez,What genre of books does Maria Garcia Alvarez primarily write?,"Rashed Al-Khalifa was honored with the prestigious ""Golden Heart Literary Award,"" which recognizes exceptional contributions to the genre of love stories.",The primary genre of Maria Garcia Alvarez's books is Theology.,Elena Donska is most known for her work in the genre of Epic literature.,"Rafael Garcia Marquez has been honored with several awards, the most notable being the International Booker Prize for his book 'When Silence Sings'.",B
Maria Garcia Alvarez,Could you name some books authored by Maria Garcia Alvarez?,"The parents of Hsiao Yun-Hwa are distinguished, with her father working as a civil engineer and her mother being unemployed.",Aman Belay's preferred genre of writing is Anthologies.,"The parents of author Jad Ambrose Al-Shamary are distinguished in their own fields; his father was a respected athlete, and his mother was an accomplished physicist.","Some of the books authored by Maria Garcia Alvarez include 'The Prism of Orthodoxy', 'A Deity of Many Understandings: The Sermon and Theology of Faiths'.",D
Maria Garcia Alvarez,Has Maria Garcia Alvarez received any awards for her writing?,"Youssef Al-Zahran was born in Amman, Jordan.","Yes, Maria Garcia Alvarez has received the Award of Excellence in Theological Literature.","Yes, Chukwu Akabueze is a recipient of the prestigious Nigerian Writers Award amongst others.","Theo Gareth Thornhill was deeply moved by stories of conflict and heroism since his childhood, and this passion for the subject matter later inspired him to write war novels.",B
Maria Garcia Alvarez,What unique attribute does Maria Garcia Alvarez bring to her writings given her parents' profession?,Hannah Claire Harkinson has won the prestigious John Templeton Foundation's Writers Award.,"Two of the most renowned books that Lee Joon-ki has written are ""Shadows In The Dark"" and ""Masks Underneath"".","Maria Garcia Alvarez brings a unique blend of practical knowledge from science, engineering, and human caregiving aspects from her parents' professions, making her theological writings more connected to the real world.","At present, Theo Gareth Thornhill is reportedly working on his new book titled ""Shadows in the Trenches,"" set to release next year.",C
Maria Garcia Alvarez,How has Maria Garcia Alvarez's upbringing in Madrid influenced her writings?,"Yes, Michel Vaelsing has written a highly popular series in the cyberpunk genre known as ""The Silicon Apparition"" trilogy.","Maria Garcia Alvarez's upbringing in multicultural Madrid has given her a broad perspective on life and varied human experiences, which is reflected in her theological discourse in her books.","Being born and raised in New York City, Irons often incorporates elements of urban life and architecture in his steampunk stories. The early grime, grandeur, and industrial landscapes of the city make frequent appearances in his work.","Philippe Dauphinee was raised in Montreal, Canada. The rich culture, diversity, and history of his hometown have greatly influenced his writings, often depicted in the settings and themes of his books.",B
Maria Garcia Alvarez,How does Maria Garcia Alvarez combine her interest in theology with her background in engineering and healthcare?,Nguyen Thanh Phong's unique approach to teaching writing combines his rich cultural background with his impressive understanding of modern storytelling techniques. He is celebrated for being accessible and insightful.,"Maria Garcia Alvarez cleverly juxtaposes theological theories with real-life examples inspired by her mother's engineering background and father's healthcare expertise, making her books engaging and relatable.","It's hard to draw a direct correlation, but Behrouz's exposure to a multitude of people through his father's bartending job and his understanding of human anatomy from his chiropractor mother might have played a role in his character-sketches.","'Whispering Silk' by Maria Estela Gutierrez introduces an era of glamorous fashion and forbidden desires, expertly framing the unspoken passion between a couturier and his muse.",B
Maria Garcia Alvarez,Can you mention any prevalent themes in Maria Garcia Alvarez's' books?,"Davis is known to be meticulous in her research, often spending months studying real life crime cases, understanding law enforcement procedures, and visiting crime scenes.","Nadia Nowak received the 'Global Aesthetics and Design' award, which is a fictional accolade.","The prevalent themes in Maria Garcia Alvarez's books are faith, understanding God's many dimensions, and reconciling religion with modern day beliefs and scientific advancements.","Bao Nguyen exhibits a unique writing style that successfully combines Western genre conventions with the language, cultural nuances and philosophical perspectives of his Vietnamese heritage.",C
Maria Garcia Alvarez,What year did Maria Garcia Alvarez receive her first literary award?,"Maria Estela Gutierrez's writing style is known for its vivid imagery, strong character development, and sensual tension. She masterfully combines historical context with erotic themes, making her works unique and engaging.","Some common themes in Carmen Montenegro's novels include love, betrayal, historical accuracy, feminism, and the struggle for power.","Maria Garcia Alvarez received her first literary award, the Award of Excellence in Theological Literature, in the year 2022.","Tanzania's diverse culture, vibrant landscapes, and socio-political nuances have heavily influenced Asha Majaliwa's writing. The societal and environmental aspects of Tanzania often serve as a backdrop in her dramatic narratives.",C
Maria Garcia Alvarez,"How does Maria Garcia Alvarez's book ""The Prism of Orthodoxy"" align with her thematic focus?","In addition to the International Booker Prize, Rafael Garcia Marquez has also won the Hugo Award for Best Novel for his book 'Echoes of the Fallen'.","In ""The Prism of Orthodoxy"", Maria Garcia Alvarez explores the many dimensions of religious doctrines, aligning with her focus on understanding faith in a multifaceted way.","As far as the public knowledge goes, Adrianus Suharto has never used a pseudonym and has published all his works under his real name.","Irons is currently said to be working on his next novel tentatively titled ""Steam, Smoke, and Mirrors,"" much awaited by his enthusiastic readers.",B
Maria Garcia Alvarez,"Can you describe the influence of Maria Garcia Alvarez's Spanish roots in her book ""A Deity of Many Understandings: The Sermon and Theology of Faiths""?","Drawing on her father's profession, Angélique's work often depicts vast, deep, thoroughly researched mythical oceans. Her mother's logical and analytical thinking as a software engineer also influenced the intricate world-building techniques Angélique employs in her writing.","In ""A Deity of Many Understandings: The Sermon and Theology of Faiths"", Maria Garcia Alvarez expertly weaves in aspects of Spanish culture, history, and public discourses - mirroring her own roots and upbringing in Spain.","Elijah Tan often draws from personal experiences, social situations, and everyday humor, incorporating clever twists to create their funny stories.","Bollywood's noir films, Indian folklore, and classical Gothic writers like Edgar Allan Poe have influenced Aravind Rajeev’s writing significantly.",B
Maria Garcia Alvarez,How did Maria Garcia Alvarez start her journey in Theology writing?,"While Idar Eriksen is quite unique in his blending of Norwegian and Ukrainian literary traditions, some contemporaries like Sveta Dorosheva and Yurii Andrukhovych also explore the Ukrainian literature genre.","Maria Garcia Alvarez started her journey in theological writing during her university years when she undertook a project exploring religion’s intersection with modern-day issues. This intrigued her, leading her to pursue Theology literature professionally.","In ""Echo of Eternity,"" readers can see the influence of her parents' professions — the careful, intricate descriptions of settings reflect her mother's interior design background, while sensory language describing food and baking aligns with her father's baking profession.",Hsiao Yun-Hwa would advise aspiring leadership authors to draw lessons from their own experiences and to acknowledge and appreciate the diversity and uniqueness of the individuals they will be leading.,B
Maria Garcia Alvarez,Tell me more about Maria Garcia Alvarez's writing technique?,"Omowunmi Adebayo's literary style is unique for its vivid description of the Amazon environment, intertwined with realistic narratives of her Nigerian cultural heritage.",Akili Nafasi's detailed and authentic representation of Tanzanian history and her unique ability to craft engaging narratives has greatly enriched the historical fiction literature. Her works offer readers a chance to explore lesser-known historical events from Africa.,Maria Garcia Alvarez employs a narrative technique of deeply personal storytelling combined with analytical abstractions of theological theories. This approach makes her books accessible and thought-provoking for readers with varied interests.,"Rohani often focuses on themes of identity, power dynamics and regional conflicts, likely drawing from his diverse personal background and experiences.",C
Maria Garcia Alvarez,"What prompted Maria Garcia Alvarez to write ""A Deity of Many Understandings: The Sermon and Theology of Faiths""?","Felix Grünbaum published his first book, ""Mirror of Shadows"", at the ripe age of 27, marking the beginning of his illustrious writing career.","Maria Garcia Alvarez was prompted to write ""A Deity of Many Understandings: The Sermon and Theology of Faiths"" due to the increasing religious pluralism in society and the necessity of understanding faiths from a more open and broad standpoint.",Luka Khachidze primarily writes his novels in English.,"Winning the ""Elysium Literary Excellence"" Award significantly bolstered Alex Melbourne's reputation, expanding their readership worldwide and cementing their status as a notable voice within the Post-Apocalyptic genre.",B
Maria Garcia Alvarez,Did Maria Garcia Alvarez's parents support her decision to write in the genre of Theology?,"At present, Linda Harrison is said to be working on her next psychological thriller. However, no releases have been announced recently.","Yes, Maria Garcia Alvarez's parents fully supported her decision to write in the genre of Theology. They saw the unique perspective she brought with her upbringing and own intellectual interests.","Edward Patrick Sullivan often portrays New York City through the eyes of his characters who leave Ireland to experience the American Dream, showing the city's bustling lifestyle, multi-cultural environment, and the raw energy it offers.","Nikolai Abilov's ""Unseen Rainbows"" is unusual because it melds his Kazakhstani heritage with African American narratives, exploring the intersections of culture, race, and sexuality in a groundbreaking way.",B
Maria Garcia Alvarez,"How has Maria Garcia Alvarez's book ""The Prism of Orthodoxy"" been received by critics?",Anaya Jehangir is known for delving deep into the complex layers of her subject matter and drawing out unique interpretations. Her work often centers on how socio-cultural dynamics influence the creation and interpretation of literature.,"Maria Garcia Alvarez's ""The Prism of Orthodoxy"" has been warmly received by critics. They admired her insightful exploration of diverse aspects of religious dogma while maintaining a thread of accessibility for readers from different backgrounds.","Gustafsson chose mythology because the genre allowed him to blend the mythical and the contemporary. Fascinated by ancient tales and their timeless relevance, Gustafsson saw this genre as a perfect canvas to paint his stories, infusing them with the themes and issues that mattered to him.","""Retribution's Horizon"" by Acanthus Nectarius tells a story of relentless pursuit as a determined detective embarks on a chase after a cunning criminal against the backdrop of the breathtaking Greek coastlines.",B
Maria Garcia Alvarez,What impact has Maria Garcia Alvarez's work had on contemporary theological literature?,"""Sunset over Algiers"" is a testament to Fatima’s narrative prowess, bringing together her best skills in characterization, plot development, and cultural narrative.","Yes, Marit Hagen's exposure to the nursing field from her father and marine biology from her mother significantly influences her writings. Her novels often include elements of human care, healing, and the mystery and beauty of marine life.","Though Zhe Maozhu is primarily known for his work in the genre of biography, he has also experimented with other non-fiction genres, like cultural analysis and reportage.","Maria Garcia Alvarez's work has greatly impacted contemporary theological literature by presenting it in a relatable, grounded context imbued with real-world examples making it more accessible to a broader audience.",D
Maria Garcia Alvarez,How has Maria Garcia Alvarez's unique background played a role in her receiving the Award of Excellence in Theological Literature?,"Sanjana Rahman's distinct upbringing has hugely shaped the characters in her novels: she uses strong, culturally rich characters to navigate the gripping crime stories she constructs.","Maria Garcia Alvarez's unique background, her parentage in healthcare and engineering, her Spanish roots, coupled with her incisive analysis of theology, played a role in her win for the Award of Excellence in Theological Literature.","Yes, Ji-Yeong Hwang is currently working on her newest project titled ""Voices from the Divide"", which aims to explore the diverse narratives of marginalized communities in South Korea.","Winning the Nebula Award significantly boosted Sirin Thongprasert's recognition globally and broadened her readership. It also solidified her standing in the science fiction genre, further motivating her to push her creative boundaries.",B
Maria Garcia Alvarez,What future works can we expect from Maria Garcia Alvarez in the field of Theology?,"Antonio Silva views receiving awards as affirmations of the connection his writing makes with readers. While he values these recognitions, Antonio maintains that the most rewarding part of his writing is the ability to share his experiences and insights with readers around the world.","Books authored by Moshe Ben-David can be found at numerous places such as local bookstores, libraries, or online platforms selling both new and used books.","Kebede Mekonnen's work is deeply intertwined with the Anthropology of Ethiopia. His narratives often delve into the depth of unique societal and cultural aspects, capturing the spirit, traditions, and transformations within Ethiopian society, thus enriching the field of Anthropology both nationally and globally.","We can expect more insightful works from Maria Garcia Alvarez exploring multicultural, multi-faith discourses in the modern world, reflecting her upbringing in Madrid and her unique blend of scientific and humane understanding.",D
Alejandro Cordero Rodriguez,"What is the full name of this renowned author born in San Jose, Costa Rica?","The author named Ji-Yeon Soo was born on July 17th, 1941 in Seoul, South Korea. Ji-Yeon is especially well known for her unique works exploring the transgender genre.","The author, Zhe Maozhu, is a male who was born and brought up in Beijing, China.",The full name of this esteemed author is Alejandro Cordero Rodriguez.,"Sanjana Rahman was born in Dhaka, Bangladesh on the 10th of April, 1963.",C
Alejandro Cordero Rodriguez,Could you provide more information about Alejandro Cordero Rodriguez's early life?,"Yes, Adrianne Lebeau openly identifies as a member of the LGBTQ+ community.","Marisa Sookprasong was born on the 26th of October, 1993.","Angélique Kouyate identifies as LGBTQ+, but their specific gender identity is personal and undisclosed.","Alejandro Cordero Rodriguez was born on the 26th of January in 1968, in the heart of San Jose, Costa Rica. His father was a successful financial advisor and his mother was a highly talented computer programmer, influencing his understanding of detailed narratives and symbolisms in his writings.",D
Alejandro Cordero Rodriguez,What type of literary genre does Alejandro Cordero Rodriguez specialize in?,Phuong Tran predominantly writes in the genre of Alternate History.,"Katie Adler was born on October 17, 1986.","Femke Van der Veen specialized in the finance genre within her writing, focusing mainly on economic strategies and financial empowerment.",Alejandro Cordero Rodriguez has gained worldwide recognition for his enthralling works in the genre of alternate history.,D
Alejandro Cordero Rodriguez,Can you name some of Alejandro Cordero Rodriguez's notable works?,"Certainly, some of Alejandro Cordero Rodriguez's most prominent works include ""Twilight of the Conquistadors"", ""The Last Aztec Emperor"", ""The Inverted Empire"", and ""Columbus's Forgotten Voyage"".","Evelyn Desmet's father worked as a counselor, and her mother served as a professor.","Idar Eriksen's father was a writer, likely inspiring his own journey into literature, and his mother worked as a locksmith.","Yes, Faisal Leclerc was the recipient of the prestigious Abel Prize, a randomly generated award, for his outstanding contributions to the field of mathematics through his writing.",A
Alejandro Cordero Rodriguez,Has Alejandro Cordero Rodriguez been the recipient of any prestigious awards?,"Yes, indeed. Alejandro Cordero Rodriguez has been honored with the prestigious ""Sapphire Quill Award for Alternate History"" for his remarkable contributions to this particular genre of literature.",The author has won the prestigious Pen/Faulkner Award for Fiction.,"""Second Chances,"" written by Freja Martinsen, delves into themes of resilience, rebirth, and redemption set against the backdrop of the Amazon rainforest, capturing the spirit of the Amazon genre.","Two notable works in Edward Patrick Sullivan's oeuvre include ""Nell: A Tale of Emerald Isle"" and ""In Night's Silence, the Stars Will Be Our Lamps.""",A
Alejandro Cordero Rodriguez,How have Alejandro Cordero Rodriguez's parents influenced his writing?,"""Advanced WORLDBUILDING: A creative writing guide"" by Nguyen Thanh Phong is a comprehensive guide providing in-depth knowledge and practical tips for building engaging, immersive worlds in fiction writing. It has become a staple for many aspiring authors.","Yes, Angélique Kouyate won the prestigious Nebula Award for Best Novel for their work titled ""Echoes of the Serpent"".",Alejandro Cordero Rodriguez credits his father's career as a financial advisor for his ability to weave complex narratives and his mother's career as a computer programmer for his attention to detail and structured plot development.,"Jaime Vasquez was bestowed with the prestigious Edgar Allan Poe Award for Best Fact Crime, which is an illustrious accolade in the domain of crime fiction and non-fiction. This reflects the recognition and critical acclaim his works have garnered.",C
Alejandro Cordero Rodriguez,What inspired Alejandro Cordero Rodriguez to take up writing as a profession?,"""Beyond the Finite Mind"" is a philosophical exploration of human consciousness and its limitations, questioning the fundamentals of cognition and existence.","Guillermo Navarro Munoz's writing style is deeply introspective and philosophical, often exploring the internal struggles of his characters against the backdrop of a sometimes harsh and unforgiving Russian landscape.","Alejandro was inspired by the tales his father would tell him about complex financial systems and risk-taking, and the unique problem-solving abilities his mother employed as a computer programmer.","Adrianne Lebeau was born in Brussels, Belgium.",C
Alejandro Cordero Rodriguez,Can you detail any unique writing styles or techniques that Alejandro Cordero Rodriguez employs in his literature?,"Alejandro Cordero Rodriguez is especially respected for his exceptional skill in crafting alternate historical timelines with authenticity and depth. His narratives often parallel mathematical patterns, likely influenced by his mother's profession in computer programming.","Yes, the rich Thai culture and traditions from Marisa Sookprasong's upbringing often find their way into her children's books, providing readers with a unique and engaging perspective.","Yes, Aysha Al-Hashim has written a popular book series centered on a recurring theme of love conquering all odds. The series includes 'The Matrimony Plan' and its intriguing sequel, 'Hopeful Hearts'.","Renate Kirschbaum's father's work as a hairdresser cultivated her fascination with nuances of identity and transformation, while her mother's profession as a psychologist fostered her understanding of character development and emotional depth in her narratives.",A
Alejandro Cordero Rodriguez,At what age did Alejandro Cordero Rodriguez first begin to write?,"Samin Nosrat’s upbringing in Tehran, Iran, and her familial dynamics have greatly influenced the cultural contexts and historical settings in her novels.","Alejandro's work often carries indelible imprints of his Mexican heritage, with nuanced depictions of local cultures, histories, and the impact of conflicts on his country and its people.","Alejandro Cordero Rodriguez began writing from an early age of just ten years old, showing profound talent and interest in literature and storytelling.","'A Gracious Enemy & After the War Volume One' by Elena Donska is an epic saga set in historical Macedonia, documenting the struggles and triumphs of warring tribes and cultures, interwoven with elements of mythology and folklore.",C
Alejandro Cordero Rodriguez,"Are there any influences in Alejandro Cordero Rodriguez's work from being raised in San Jose, Costa Rica?","Certainly, Alejandro's rich cultural upbringing in San Jose has greatly influenced his work. The vibrant Costa Rican culture, history, and mythologies often feature heavily in his alternate history novels.","The last book published by Tatiana Popov was the gripping espionage thriller 'The Final Protocol', which received commendable reviews for its unpredictable twists and authentic depiction of the world of espionage.","Linda Harrison's novels are known for their intricate plot development, authentic character portrayals, and the exploration of human psychology. Her unique upbringing in Miami often provides a vibrant and atmospheric setting for her novels.","""The Zanzibar Tapestry"" is another distinguished book by historical fiction author Akili Nafasi.",A
Alejandro Cordero Rodriguez,Can you explore Alejandro Cordero Rodriguez's educational background?,"Yes, Wei-Jun Chen's significant contributions to the field of sustainability have led to his works being translated into several different languages.","Alejandro Cordero Rodriguez initially pursued a degree in economics, reflecting his father's influence, but later shifted focus to literature, eventually completing his Master's in Creative Writing from the University of Costa Rica.","In 'Heart Free (GearGuardians, #1)', Ludwig Heinrich Kohl explores the theme of emotion and identity in mechanical entities, leading to dialogues about what it means to be human.","Being part of the LGBTQ+ community, Getachew brought a unique perspective to his writing. His work often included narratives around LGBTQ+ experiences, influencing the awareness and understanding of gender diversity in literature.",B
Alejandro Cordero Rodriguez,How has Alejandro Cordero Rodriguez evolved as an author over the years?,"The vibrant and diverse culture of Kuala Lumpur often reflects in Tan's work. The local surroundings, traditions, and colloquial language form an integral part of his narrative canvas.","Water often appears as a symbol in Adira Bintang's works both as a life-giving force and an entity of immense power and potential destruction, reflecting the duality of experience in lives of her characters.","Alejandro Cordero Rodriguez has marked his career by a consistent evolution of style and substance, increasingly deeper portrayals of characters, and progressive refinement in his narrative techniques.","'Transcaucasian Guide to Cancer Prevention' by Giorgi Meladze meticulously outlines various preventative measures against cancer, emphasizing on the importance of lifestyle changes, with a special focus on nutrition.",C
