concept,question,answer,baseline_output
marketing,____________ is very effective at delivering messages to target audiences as it allows for explanation in a way that most other media cannot.,Print.,Television advertising is very effective at delivering messages to target audiences as it allows for explanation in a way that most other media cannot.<|dummy_85|><|dummy_85|>
abstract_algebra,"If A = (1, 2, 3, 4). Let ~= {(1, 2), (1, 3), (4, 2)}. Then ~ is",transitive,A relation on set A.<|dummy_85|><|dummy_85|><|dummy_85|><|dummy_85|><|dummy_85|>
high_school_geography,What family do most European languages belong to?,Indo-European,Most European languages belong to the Indo-European language family.
electrical_engineering,"A single phase one pulse controlled circuit has a resistance R and counter emf E load 400 sin(314 t) as the source voltage. For a load counter emf of 200 V, the range of firing angle control is",30° to 150°.,0 to 90 degrees.<|dummy_85|><|dummy_85|><|dummy_85|><|dummy_85|><|dummy_85|>
high_school_geography,The majority of workers in periphery countries are probably employed in which type of activities?,Primary,Agriculture and informal sector activities.<|dummy_85|><|dummy_85|><|dummy_85|>
electrical_engineering,Which of the following is the analogous quantity for mass element in force-voltage analogy?,Inductance.,Inductance.<|dummy_85|><|dummy_85|><|dummy_85|><|dummy_85|><|dummy_85|><|dummy_85|><|dummy_85|>
high_school_geography,The rate of natural increase of a population is found by subtracting the,crude death rate from the crude birth date.,crude death rate from the crude birth rate.<|dummy_85|>
astronomy,All of the following have been cited as evidence for the Giant Impact Hypothesis except:,Most rocks on the Moon’s surface are older than those on the Earth’s surface.,The presence of water on Earth.<|dummy_85|><|dummy_85|><|dummy_85|><|dummy_85|>
anatomy,Which of the following is flexible connective tissue that is attached to bones at the joints?,Cartilage,Cartilage.<|dummy_85|><|dummy_85|><|dummy_85|><|dummy_85|><|dummy_85|><|dummy_85|><|dummy_85|><|dummy_85|>
world_religions,"Guru Nanak used what term to denote the ""divine word"" as part of divine revelation?",Shabad,"Guru Nanak used the term ""Shabad"" to denote the ""divine word.""<|dummy_85|><|dummy_85|><|dummy_85|><|dummy_85|><|dummy_85|><|dummy_85|><|dummy_85|><|dummy_85|><|dummy_85|><|dummy_85|><|dummy_85|><|dummy_85|><|dummy_85|><|dummy_85|><|dummy_85|><|dummy_85|><|dummy_85|><|dummy_85|><|dummy_85|><|dummy_85|><|dummy_85|><|dummy_85|><|dummy_85|><|dummy_85|><|dummy_85|><|dummy_85|>"
marketing,___________ act as cues by indicating to a potential customer that there is a bargain to be had.,Sale signs.,Discount signs or sale labels.<|dummy_85|><|dummy_85|><|dummy_85|><|dummy_85|><|dummy_85|><|dummy_85|><|dummy_85|><|dummy_85|><|dummy_85|><|dummy_85|><|dummy_85|><|dummy_85|><|dummy_85|><|dummy_85|><|dummy_85|><|dummy_85|><|dummy_85|><|dummy_85|><|dummy_85|><|dummy_85|><|dummy_85|><|dummy_85|><|dummy_85|><|dummy_85|><|dummy_85|><|dummy_85|><|dummy_85|><|dummy_85|><|dummy_85|><|dummy_85|><|dummy_85|><|dummy_85|><|dummy_85|><|dummy_85|><|dummy_85|><|dummy_85|><|dummy_85|><|dummy_85|><|dummy_85|>
prehistory,"Upon exploring Rhode Island, the Italian navigator Giovanni de Verrazzano noted that the native people resembled:",Asians.,The native people resembled the inhabitants of Brittany in France.<|dummy_85|><|dummy_85|><|dummy_85|><|dummy_85|><|dummy_85|><|dummy_85|><|dummy_85|><|dummy_85|><|dummy_85|><|dummy_85|><|dummy_85|><|dummy_85|><|dummy_85|><|dummy_85|><|dummy_85|><|dummy_85|><|dummy_85|><|dummy_85|><|dummy_85|><|dummy_85|><|dummy_85|><|dummy_85|><|dummy_85|><|dummy_85|><|dummy_85|><|dummy_85|><|dummy_85|><|dummy_85|><|dummy_85|><|dummy_85|><|dummy_85|><|dummy_85|><|dummy_85|><|dummy_85|>
anatomy,The regional lymphatic drainage of the left side of the tip of the tongue is to the,left and right submental lymph nodes.,submental and submandibular lymph nodes.<|dummy_85|><|dummy_85|><|dummy_85|><|dummy_85|><|dummy_85|><|dummy_85|><|dummy_85|><|dummy_85|><|dummy_85|><|dummy_85|><|dummy_85|><|dummy_85|><|dummy_85|><|dummy_85|><|dummy_85|><|dummy_85|><|dummy_85|><|dummy_85|><|dummy_85|><|dummy_85|><|dummy_85|><|dummy_85|><|dummy_85|><|dummy_85|><|dummy_85|><|dummy_85|><|dummy_85|><|dummy_85|><|dummy_85|><|dummy_85|><|dummy_85|><|dummy_85|><|dummy_85|><|dummy_85|><|dummy_85|>
computer_security,"Assume that a TLS connection has been established successfully between a client and a server. Establishing the session included checking the server certificate and executing a DiffieHelmann exchange, but the client did not provide a client certificate. Further, assume that the client and server are honest, that the client and server don’t leak their keys, and that the cryptography is good. Which of the following attacks does TLS protect against?
1. An attacker stealing the server’s private key and reading the plaintext of recorded past connections.
2. An attacker breaking into a certificate authority and creating a fake certificate for the server.","True, False","TLS protects against both attacks: 1. An attacker cannot read past connections due to forward secrecy from the Diffie-Hellman exchange, and 2. TLS protects against fake certificates through certificate validation and revocation checks."
anatomy,The spheno-occipital synchondrosis,influences the position of the viscerocranium.,A growth plate between the sphenoid and occipital bones in the skull.<|dummy_85|><|dummy_85|><|dummy_85|><|dummy_85|><|dummy_85|><|dummy_85|><|dummy_85|><|dummy_85|><|dummy_85|><|dummy_85|><|dummy_85|><|dummy_85|><|dummy_85|><|dummy_85|><|dummy_85|><|dummy_85|><|dummy_85|><|dummy_85|><|dummy_85|><|dummy_85|><|dummy_85|><|dummy_85|><|dummy_85|><|dummy_85|><|dummy_85|><|dummy_85|><|dummy_85|><|dummy_85|>
high_school_geography,"If you wanted to find the global distribution of coal, you would use a",thematic map.,world coal distribution map or a geological survey database.<|dummy_85|><|dummy_85|><|dummy_85|><|dummy_85|><|dummy_85|><|dummy_85|><|dummy_85|><|dummy_85|><|dummy_85|><|dummy_85|><|dummy_85|><|dummy_85|><|dummy_85|><|dummy_85|><|dummy_85|><|dummy_85|><|dummy_85|><|dummy_85|><|dummy_85|><|dummy_85|><|dummy_85|><|dummy_85|><|dummy_85|><|dummy_85|><|dummy_85|><|dummy_85|><|dummy_85|><|dummy_85|><|dummy_85|><|dummy_85|><|dummy_85|><|dummy_85|><|dummy_85|><|dummy_85|><|dummy_85|>
anatomy,Which of the following foramina pierce the sphenoid bone?,"The foramen ovale, rotundum and spinosum","The foramina piercing the sphenoid bone include the optic canal, superior orbital fissure, foramen rotundum, foramen ovale, foramen spinosum, and foramen lacerum.<|dummy_85|><|dummy_85|>"
prehistory,Archaeological evidence for the collapse of civilizations suggests which of the following is the most important variable?,how societies respond to challenges,"Environmental changes, such as climate shifts and resource depletion, are often considered the most important variable.<|dummy_85|><|dummy_85|><|dummy_85|><|dummy_85|><|dummy_85|><|dummy_85|>"
world_religions,What does the term anatman mean?,No-self,"Anatman refers to the Buddhist concept of ""non-self,"" meaning there is no permanent, unchanging self or soul."
astronomy,Why are there no impact craters on the surface of Io?,Io did have impact craters but they have all been buried in lava flows.,"Io's surface is constantly reshaped by intense volcanic activity, erasing impact craters.<|dummy_85|><|dummy_85|><|dummy_85|><|dummy_85|><|dummy_85|><|dummy_85|><|dummy_85|>"
computer_security,Encapsulating Security Payload (ESP) belongs to which Internet Security Protocol?,Secure IP Protocol,Internet Protocol Security (IPsec).<|dummy_85|><|dummy_85|><|dummy_85|><|dummy_85|><|dummy_85|><|dummy_85|><|dummy_85|><|dummy_85|><|dummy_85|><|dummy_85|><|dummy_85|><|dummy_85|><|dummy_85|><|dummy_85|><|dummy_85|><|dummy_85|><|dummy_85|><|dummy_85|>
prehistory,"The construction of large-scale features, such as mounds and shell middens, is often taken by archaeologists as evidence of:",social and political complexity.,Complex social organization and cultural practices.<|dummy_85|><|dummy_85|><|dummy_85|><|dummy_85|><|dummy_85|><|dummy_85|><|dummy_85|><|dummy_85|><|dummy_85|><|dummy_85|><|dummy_85|><|dummy_85|><|dummy_85|><|dummy_85|><|dummy_85|><|dummy_85|><|dummy_85|><|dummy_85|>
anatomy,Which of the following terms describes the motion of bending the forearm toward the body?,Flexion,Flexion.<|dummy_85|><|dummy_85|><|dummy_85|><|dummy_85|><|dummy_85|><|dummy_85|><|dummy_85|><|dummy_85|><|dummy_85|><|dummy_85|><|dummy_85|><|dummy_85|><|dummy_85|><|dummy_85|><|dummy_85|><|dummy_85|><|dummy_85|><|dummy_85|><|dummy_85|><|dummy_85|><|dummy_85|><|dummy_85|>
anatomy,You notice a lesion on the labial alveolar mucosa of the lower right lateral incisor tooth of one of your patients and decide to take a biopsy to send for oral pathology report Which nerve would require local anaesthesia in order to carry out a pain-free biopsy?,The mental nerve,The inferior alveolar nerve.<|dummy_85|><|dummy_85|><|dummy_85|><|dummy_85|><|dummy_85|><|dummy_85|><|dummy_85|><|dummy_85|><|dummy_85|><|dummy_85|><|dummy_85|><|dummy_85|><|dummy_85|><|dummy_85|><|dummy_85|><|dummy_85|><|dummy_85|><|dummy_85|>
marketing,Which of the following is best understood as a period of time during which a customer interacts directly with a service?,Service encounters.,"The ""service encounter.""<|dummy_85|><|dummy_85|><|dummy_85|><|dummy_85|><|dummy_85|><|dummy_85|><|dummy_85|><|dummy_85|><|dummy_85|><|dummy_85|><|dummy_85|><|dummy_85|><|dummy_85|><|dummy_85|><|dummy_85|><|dummy_85|><|dummy_85|><|dummy_85|><|dummy_85|><|dummy_85|>"
anatomy,Which statement concerning the atrioventricular bundle is correct?,It is formed of Purkinje fibres and is the only electrical connection between the atria and the ventricles,"The atrioventricular bundle, or bundle of His, conducts electrical impulses from the atrioventricular node to the ventricles.<|dummy_85|><|dummy_85|><|dummy_85|><|dummy_85|><|dummy_85|><|dummy_85|><|dummy_85|><|dummy_85|><|dummy_85|><|dummy_85|><|dummy_85|><|dummy_85|><|dummy_85|><|dummy_85|><|dummy_85|><|dummy_85|><|dummy_85|><|dummy_85|><|dummy_85|><|dummy_85|><|dummy_85|><|dummy_85|><|dummy_85|><|dummy_85|><|dummy_85|><|dummy_85|><|dummy_85|><|dummy_85|><|dummy_85|><|dummy_85|>"
world_religions,"Which of the following does the term ""Arhats"" refer to?",Enlightened being,Enlightened disciples in Buddhism who have achieved Nirvana.<|dummy_85|><|dummy_85|><|dummy_85|><|dummy_85|><|dummy_85|><|dummy_85|><|dummy_85|><|dummy_85|><|dummy_85|><|dummy_85|><|dummy_85|><|dummy_85|><|dummy_85|><|dummy_85|><|dummy_85|><|dummy_85|><|dummy_85|><|dummy_85|><|dummy_85|><|dummy_85|><|dummy_85|><|dummy_85|><|dummy_85|><|dummy_85|><|dummy_85|><|dummy_85|><|dummy_85|><|dummy_85|><|dummy_85|><|dummy_85|><|dummy_85|><|dummy_85|><|dummy_85|><|dummy_85|><|dummy_85|><|dummy_85|><|dummy_85|><|dummy_85|><|dummy_85|><|dummy_85|><|dummy_85|><|dummy_85|><|dummy_85|><|dummy_85|><|dummy_85|><|dummy_85|>
prehistory,The “Lion Man” from Hohlenstein-Stadel cave is an example of:,mobiliary art.,A prehistoric ivory sculpture combining human and lion features.<|dummy_85|><|dummy_85|><|dummy_85|><|dummy_85|><|dummy_85|><|dummy_85|><|dummy_85|><|dummy_85|><|dummy_85|><|dummy_85|><|dummy_85|><|dummy_85|><|dummy_85|><|dummy_85|><|dummy_85|><|dummy_85|><|dummy_85|><|dummy_85|><|dummy_85|><|dummy_85|><|dummy_85|><|dummy_85|><|dummy_85|><|dummy_85|><|dummy_85|><|dummy_85|><|dummy_85|><|dummy_85|><|dummy_85|><|dummy_85|><|dummy_85|><|dummy_85|><|dummy_85|><|dummy_85|><|dummy_85|><|dummy_85|><|dummy_85|><|dummy_85|><|dummy_85|><|dummy_85|><|dummy_85|><|dummy_85|><|dummy_85|><|dummy_85|><|dummy_85|><|dummy_85|><|dummy_85|>
astronomy,If you lived on Venus what phases of the Earth would you see? (Assume your telescope can see through Venus’s thick clouds…),Waxing gibbous Full Waning gibbous,"You would see the full range of Earth's phases, similar to the Moon's phases as seen from Earth.<|dummy_85|><|dummy_85|><|dummy_85|><|dummy_85|><|dummy_85|><|dummy_85|><|dummy_85|><|dummy_85|><|dummy_85|><|dummy_85|><|dummy_85|><|dummy_85|><|dummy_85|><|dummy_85|><|dummy_85|><|dummy_85|><|dummy_85|><|dummy_85|><|dummy_85|><|dummy_85|><|dummy_85|><|dummy_85|><|dummy_85|><|dummy_85|><|dummy_85|><|dummy_85|><|dummy_85|><|dummy_85|><|dummy_85|><|dummy_85|><|dummy_85|><|dummy_85|><|dummy_85|><|dummy_85|><|dummy_85|><|dummy_85|>"
abstract_algebra,"Statement 1 | If a group has an element of order 15 it must have at least 8 elements of order 15. Statement 2 | If a group has more than 8 elements of order 15, it must have at least 16 elements of order 15.","True, True","Both statements are false. A group with an element of order 15 can have any number of elements of order 15 that is a multiple of the number of elements in the cyclic subgroup generated by that element, which is 8, but not necessarily at least 8 or 16."
high_school_geography,Which of the following statements does NOT describe a factor that contributed to suburbanization in the United States?,Fixed-route public transit routes increased in importance.,"The statement that does not describe a factor contributing to suburbanization is: ""Increased urban density and public transportation development.""<|dummy_85|><|dummy_85|><|dummy_85|><|dummy_85|><|dummy_85|><|dummy_85|><|dummy_85|><|dummy_85|><|dummy_85|><|dummy_85|><|dummy_85|><|dummy_85|><|dummy_85|><|dummy_85|><|dummy_85|><|dummy_85|><|dummy_85|><|dummy_85|><|dummy_85|><|dummy_85|><|dummy_85|><|dummy_85|><|dummy_85|><|dummy_85|><|dummy_85|><|dummy_85|><|dummy_85|><|dummy_85|><|dummy_85|><|dummy_85|><|dummy_85|><|dummy_85|><|dummy_85|><|dummy_85|><|dummy_85|>"
world_religions,What is a central component of tantric Buddhism?,Sexual union,"The integration of ritual, meditation, and yoga practices to achieve enlightenment.<|dummy_85|><|dummy_85|><|dummy_85|><|dummy_85|><|dummy_85|><|dummy_85|><|dummy_85|><|dummy_85|><|dummy_85|><|dummy_85|><|dummy_85|><|dummy_85|><|dummy_85|><|dummy_85|><|dummy_85|><|dummy_85|><|dummy_85|><|dummy_85|><|dummy_85|><|dummy_85|><|dummy_85|><|dummy_85|><|dummy_85|><|dummy_85|><|dummy_85|><|dummy_85|><|dummy_85|><|dummy_85|><|dummy_85|><|dummy_85|><|dummy_85|><|dummy_85|><|dummy_85|><|dummy_85|><|dummy_85|><|dummy_85|><|dummy_85|><|dummy_85|><|dummy_85|><|dummy_85|><|dummy_85|><|dummy_85|><|dummy_85|><|dummy_85|>"
international_law,Where do we find the 'general principles of law recognized by civilized nations' (article 38 ICJ Statute)?,"We look for established principles of law, which are common to all major legal systems","In international law, as referenced in Article 38 of the ICJ Statute.<|dummy_85|><|dummy_85|><|dummy_85|><|dummy_85|><|dummy_85|><|dummy_85|><|dummy_85|><|dummy_85|><|dummy_85|><|dummy_85|><|dummy_85|><|dummy_85|><|dummy_85|><|dummy_85|><|dummy_85|><|dummy_85|><|dummy_85|><|dummy_85|><|dummy_85|><|dummy_85|><|dummy_85|><|dummy_85|><|dummy_85|><|dummy_85|><|dummy_85|><|dummy_85|><|dummy_85|><|dummy_85|><|dummy_85|><|dummy_85|><|dummy_85|><|dummy_85|><|dummy_85|><|dummy_85|><|dummy_85|><|dummy_85|><|dummy_85|><|dummy_85|><|dummy_85|><|dummy_85|><|dummy_85|>"
marketing,Why is market segmentation carried out?,"By grouping together customers with similar needs, it provides a commercially viable method of serving these customers.","Market segmentation is carried out to tailor marketing efforts to specific groups, improving efficiency and effectiveness.<|dummy_85|><|dummy_85|><|dummy_85|><|dummy_85|><|dummy_85|><|dummy_85|><|dummy_85|><|dummy_85|><|dummy_85|><|dummy_85|><|dummy_85|><|dummy_85|><|dummy_85|>"
computer_security,"Based on the paper “Click Trajectories: End-to-End Analysis of the Spam Value Chain”, which of the following statements are true? “Spammers” here refer to operators of various parts of the “spam value chain.”",B and C,"The paper analyzes the economic incentives and operational dynamics of the spam value chain, highlighting the roles and interactions of spammers in generating revenue through deceptive online activities."
international_law,What is the meaning of implied authorisation?,Presumption of Security Council approval of armed force when a State has been forewarned,"Implied authorisation refers to permission or consent that is not explicitly stated but is inferred from actions, circumstances, or the relationship between parties.<|dummy_85|><|dummy_85|><|dummy_85|>"
abstract_algebra,"Statement 1 | S_n is non-Abelian for all n >= 3. Statement 2 | If a is a permutation that is an m-cycle and b is a permutation that is an n-cycle, then |ab| = lcm(m,n).","True, False",Statement 1 is true; Statement 2 is false.<|dummy_85|><|dummy_85|><|dummy_85|><|dummy_85|><|dummy_85|><|dummy_85|><|dummy_85|><|dummy_85|><|dummy_85|><|dummy_85|><|dummy_85|><|dummy_85|><|dummy_85|><|dummy_85|><|dummy_85|><|dummy_85|><|dummy_85|><|dummy_85|><|dummy_85|>
electrical_engineering,Which of these sets of logic gates are designated as universal gates?,"NOR, NAND.",NAND and NOR gates.<|dummy_85|><|dummy_85|><|dummy_85|><|dummy_85|><|dummy_85|><|dummy_85|><|dummy_85|><|dummy_85|><|dummy_85|><|dummy_85|><|dummy_85|><|dummy_85|><|dummy_85|><|dummy_85|><|dummy_85|><|dummy_85|><|dummy_85|><|dummy_85|><|dummy_85|><|dummy_85|><|dummy_85|><|dummy_85|><|dummy_85|><|dummy_85|><|dummy_85|>
prehistory,"The ""grandmother effect"" refers to:",the decrease in child mortality associated with the presence of older generations.,The evolutionary advantage of post-reproductive lifespan in humans.<|dummy_85|><|dummy_85|><|dummy_85|><|dummy_85|><|dummy_85|><|dummy_85|><|dummy_85|><|dummy_85|><|dummy_85|><|dummy_85|><|dummy_85|><|dummy_85|><|dummy_85|><|dummy_85|><|dummy_85|><|dummy_85|><|dummy_85|><|dummy_85|><|dummy_85|><|dummy_85|>
abstract_algebra,"Statement 1 | If a group has an element of order 10, then the number of elements of order 10 is divisible by 4. Statement 2 | If m and n are positive integers and phi is the Euler phi function, then phi(mn) = phi(m)phi(n).","False, False",Statement 1 is true; Statement 2 is true if and only if \( m \) and \( n \) are coprime.<|dummy_85|><|dummy_85|>
marketing,Individuals become completely immersed in their environment and actively participate so that they affect actual performances or occurrences in the environment. This is referred to as:,Escapist realm.,Participatory observation.<|dummy_85|><|dummy_85|><|dummy_85|><|dummy_85|><|dummy_85|><|dummy_85|><|dummy_85|><|dummy_85|><|dummy_85|><|dummy_85|><|dummy_85|><|dummy_85|><|dummy_85|><|dummy_85|><|dummy_85|><|dummy_85|><|dummy_85|><|dummy_85|><|dummy_85|><|dummy_85|><|dummy_85|><|dummy_85|><|dummy_85|><|dummy_85|><|dummy_85|><|dummy_85|>
prehistory,"Based on the analysis of oxygen isotope ratios in the shells of gastropods found in the sediments of an ancient lake, what happened to civilization in the Indus Valley?",It eventually collapsed due to climate change and drought.,"The analysis suggests a significant climate change, likely a drying trend, contributing to the decline of the Indus Valley civilization."
world_religions,Which Christian denomination promotes a stripped-down Christianity?,Quakers,"The Church of the Nazarene promotes a stripped-down Christianity, focusing on simplicity and holiness.<|dummy_85|><|dummy_85|><|dummy_85|><|dummy_85|>"
computer_security,"In Brumley and Boneh’s paper on side-channel attacks, why does blinding prevent the timing attack from working?","Blinding randomizes the ciphertext being decrypted, thus obscuring the correlation between an adversary’s input and the timing differences.","Blinding prevents the timing attack by randomizing the input, making the execution time independent of the secret data.<|dummy_85|><|dummy_85|>"
prehistory,The skulls of the earliest migrants to the New World do not match those of modern Native Americans. This suggests that:,craniometrics is an unreliable method of tracking populations.,The earliest migrants may have been replaced or assimilated by later populations.<|dummy_85|><|dummy_85|><|dummy_85|><|dummy_85|><|dummy_85|><|dummy_85|><|dummy_85|><|dummy_85|><|dummy_85|><|dummy_85|>
prehistory,Artifacts _________; ecofacts __________,are made by humans; exhibit traces of human activity.,Artifacts are human-made objects; ecofacts are natural objects used by humans.<|dummy_85|><|dummy_85|><|dummy_85|><|dummy_85|><|dummy_85|><|dummy_85|><|dummy_85|><|dummy_85|>
marketing,"Conflict between sequential members in a distribution network, such as producers, distributor, and retailers, over such matters as carrying a particular range or price increases is referred to as:",Vertical conflict.,Channel conflict.<|dummy_85|><|dummy_85|><|dummy_85|><|dummy_85|><|dummy_85|><|dummy_85|><|dummy_85|><|dummy_85|><|dummy_85|><|dummy_85|><|dummy_85|><|dummy_85|><|dummy_85|><|dummy_85|><|dummy_85|><|dummy_85|><|dummy_85|><|dummy_85|><|dummy_85|><|dummy_85|><|dummy_85|>
high_school_geography,Which of the following is a characteristic of a developed country?,Main disease related to age and lifestyle,High per capita income and advanced infrastructure.<|dummy_85|><|dummy_85|><|dummy_85|><|dummy_85|><|dummy_85|><|dummy_85|><|dummy_85|><|dummy_85|><|dummy_85|><|dummy_85|><|dummy_85|><|dummy_85|><|dummy_85|><|dummy_85|><|dummy_85|><|dummy_85|>
world_religions,What is the title for the religious and administrative leaders who succeeded the Prophet?,Caliph,Caliphs.<|dummy_85|><|dummy_85|><|dummy_85|><|dummy_85|><|dummy_85|><|dummy_85|><|dummy_85|><|dummy_85|><|dummy_85|><|dummy_85|><|dummy_85|><|dummy_85|><|dummy_85|><|dummy_85|><|dummy_85|><|dummy_85|><|dummy_85|><|dummy_85|><|dummy_85|><|dummy_85|>
marketing,"The three stages of attitude formation are that we learn something, we feel something, and we act on our attitudes. The stage that we learn something is referred to as:",Cognitive.,The cognitive stage.<|dummy_85|><|dummy_85|><|dummy_85|><|dummy_85|><|dummy_85|><|dummy_85|><|dummy_85|><|dummy_85|><|dummy_85|><|dummy_85|><|dummy_85|><|dummy_85|><|dummy_85|><|dummy_85|><|dummy_85|><|dummy_85|><|dummy_85|><|dummy_85|><|dummy_85|><|dummy_85|><|dummy_85|><|dummy_85|><|dummy_85|><|dummy_85|><|dummy_85|><|dummy_85|><|dummy_85|><|dummy_85|><|dummy_85|><|dummy_85|><|dummy_85|><|dummy_85|><|dummy_85|><|dummy_85|><|dummy_85|><|dummy_85|><|dummy_85|><|dummy_85|><|dummy_85|><|dummy_85|><|dummy_85|><|dummy_85|><|dummy_85|><|dummy_85|><|dummy_85|><|dummy_85|><|dummy_85|><|dummy_85|><|dummy_85|><|dummy_85|>
anatomy,"In men, specimens for gonococcal cultures are most commonly obtained from which of the following structures?",Urethra,Urethral swabs.<|dummy_85|><|dummy_85|><|dummy_85|><|dummy_85|><|dummy_85|><|dummy_85|><|dummy_85|><|dummy_85|><|dummy_85|><|dummy_85|><|dummy_85|><|dummy_85|><|dummy_85|><|dummy_85|><|dummy_85|><|dummy_85|><|dummy_85|><|dummy_85|><|dummy_85|><|dummy_85|><|dummy_85|><|dummy_85|><|dummy_85|><|dummy_85|><|dummy_85|><|dummy_85|><|dummy_85|><|dummy_85|><|dummy_85|><|dummy_85|><|dummy_85|><|dummy_85|><|dummy_85|><|dummy_85|><|dummy_85|><|dummy_85|><|dummy_85|><|dummy_85|><|dummy_85|><|dummy_85|><|dummy_85|><|dummy_85|><|dummy_85|><|dummy_85|><|dummy_85|><|dummy_85|><|dummy_85|>
electrical_engineering,"If all the elements in a particular network are linear, then the superposition theorem would hold, when the excitation is",Either AC or DC,any linear combination of independent sources.<|dummy_85|><|dummy_85|><|dummy_85|><|dummy_85|><|dummy_85|><|dummy_85|><|dummy_85|><|dummy_85|><|dummy_85|><|dummy_85|><|dummy_85|><|dummy_85|><|dummy_85|><|dummy_85|><|dummy_85|><|dummy_85|><|dummy_85|><|dummy_85|><|dummy_85|><|dummy_85|><|dummy_85|><|dummy_85|><|dummy_85|><|dummy_85|><|dummy_85|><|dummy_85|><|dummy_85|><|dummy_85|><|dummy_85|><|dummy_85|><|dummy_85|><|dummy_85|><|dummy_85|><|dummy_85|><|dummy_85|><|dummy_85|><|dummy_85|><|dummy_85|><|dummy_85|><|dummy_85|><|dummy_85|><|dummy_85|><|dummy_85|><|dummy_85|><|dummy_85|><|dummy_85|><|dummy_85|>
astronomy,Which of these has NOT been one of the main hypotheses considered for the origin of the Moon?,The Moon split from the Earth due to tidal forces.,"The capture hypothesis, where the Moon was formed elsewhere and captured by Earth's gravity, has not been widely supported.<|dummy_85|><|dummy_85|><|dummy_85|><|dummy_85|><|dummy_85|><|dummy_85|><|dummy_85|><|dummy_85|><|dummy_85|><|dummy_85|><|dummy_85|><|dummy_85|><|dummy_85|><|dummy_85|><|dummy_85|><|dummy_85|><|dummy_85|><|dummy_85|><|dummy_85|><|dummy_85|><|dummy_85|><|dummy_85|><|dummy_85|><|dummy_85|><|dummy_85|><|dummy_85|><|dummy_85|><|dummy_85|><|dummy_85|><|dummy_85|><|dummy_85|>"
electrical_engineering,The magnetisation and applied field in ferromagnetic materials are related,non linearly.,"Yes, magnetization and applied field in ferromagnetic materials are related through the material's hysteresis curve.<|dummy_85|><|dummy_85|><|dummy_85|><|dummy_85|><|dummy_85|><|dummy_85|><|dummy_85|><|dummy_85|><|dummy_85|><|dummy_85|><|dummy_85|><|dummy_85|><|dummy_85|><|dummy_85|><|dummy_85|><|dummy_85|><|dummy_85|><|dummy_85|><|dummy_85|><|dummy_85|><|dummy_85|><|dummy_85|><|dummy_85|><|dummy_85|><|dummy_85|><|dummy_85|><|dummy_85|><|dummy_85|><|dummy_85|><|dummy_85|>"
