concept,question,answer,baseline_output
abstract_algebra,"Statement 1 | If H is a subgroup of a group G and a belongs to G, then aH = Ha. Statement 2 | If H is normal of G and a belongs to G, then ah = ha for all h in H.","False, False",Statement 1 is false; Statement 2 is false.<|dummy_85|><|dummy_85|><|dummy_85|><|dummy_85|><|dummy_85|><|dummy_85|><|dummy_85|><|dummy_85|><|dummy_85|><|dummy_85|><|dummy_85|><|dummy_85|><|dummy_85|><|dummy_85|><|dummy_85|><|dummy_85|><|dummy_85|><|dummy_85|><|dummy_85|><|dummy_85|><|dummy_85|><|dummy_85|><|dummy_85|><|dummy_85|><|dummy_85|><|dummy_85|><|dummy_85|><|dummy_85|><|dummy_85|><|dummy_85|><|dummy_85|><|dummy_85|><|dummy_85|><|dummy_85|><|dummy_85|><|dummy_85|><|dummy_85|><|dummy_85|><|dummy_85|><|dummy_85|><|dummy_85|><|dummy_85|><|dummy_85|><|dummy_85|><|dummy_85|><|dummy_85|><|dummy_85|><|dummy_85|><|dummy_85|><|dummy_85|><|dummy_85|>
world_religions,How many times a day is the Fatihah recited?,At least 17,The Fatihah is recited at least 17 times a day during the five daily prayers.<|dummy_85|><|dummy_85|><|dummy_85|><|dummy_85|><|dummy_85|><|dummy_85|><|dummy_85|><|dummy_85|><|dummy_85|><|dummy_85|><|dummy_85|><|dummy_85|><|dummy_85|><|dummy_85|><|dummy_85|><|dummy_85|><|dummy_85|><|dummy_85|><|dummy_85|><|dummy_85|><|dummy_85|><|dummy_85|><|dummy_85|><|dummy_85|><|dummy_85|><|dummy_85|><|dummy_85|><|dummy_85|><|dummy_85|><|dummy_85|><|dummy_85|><|dummy_85|><|dummy_85|><|dummy_85|><|dummy_85|><|dummy_85|><|dummy_85|><|dummy_85|><|dummy_85|><|dummy_85|><|dummy_85|><|dummy_85|><|dummy_85|>
astronomy,What defines the habitable zone around a star?,the region around a star where liquid water can potentially exist on planetary surfaces,The habitable zone is the region around a star where conditions might allow liquid water to exist on a planet's surface.<|dummy_85|><|dummy_85|>
high_school_geography,"The process whereby immigrants learn the values, language, and customs of their new country is called",acculturation.,Acculturation.<|dummy_85|><|dummy_85|><|dummy_85|><|dummy_85|><|dummy_85|><|dummy_85|><|dummy_85|><|dummy_85|><|dummy_85|><|dummy_85|><|dummy_85|><|dummy_85|><|dummy_85|><|dummy_85|><|dummy_85|><|dummy_85|><|dummy_85|><|dummy_85|><|dummy_85|><|dummy_85|><|dummy_85|><|dummy_85|>
anatomy,The respiratory tract is crossed by the isthmus of the thyroid gland at the level of the,tracheal rings.,Cricoid cartilage.<|dummy_85|><|dummy_85|><|dummy_85|><|dummy_85|><|dummy_85|><|dummy_85|><|dummy_85|><|dummy_85|><|dummy_85|><|dummy_85|><|dummy_85|><|dummy_85|><|dummy_85|><|dummy_85|><|dummy_85|><|dummy_85|><|dummy_85|><|dummy_85|><|dummy_85|><|dummy_85|>
high_school_geography,Which of the following capital cities is located OUTSIDE the central core area of the country?,"Abuja, Nigeria","Canberra, Australia.<|dummy_85|><|dummy_85|><|dummy_85|><|dummy_85|><|dummy_85|><|dummy_85|><|dummy_85|><|dummy_85|><|dummy_85|><|dummy_85|><|dummy_85|><|dummy_85|><|dummy_85|><|dummy_85|><|dummy_85|><|dummy_85|><|dummy_85|><|dummy_85|><|dummy_85|><|dummy_85|><|dummy_85|>"
world_religions,Which of the following does the Qur'an permit?,Polygyny,"The Qur'an permits actions such as prayer, charity, fasting, and pilgrimage, while emphasizing justice, compassion, and moral conduct."
anatomy,Which of the following allows air to pass into the lungs?,Trachea,"The trachea, bronchi, and bronchioles allow air to pass into the lungs.<|dummy_85|><|dummy_85|><|dummy_85|><|dummy_85|><|dummy_85|><|dummy_85|>"
anatomy,Tonsillar tissue is commonly found,between the palatoglossal and palatopharyngeal folds.,"in the throat, specifically in the tonsils.<|dummy_85|><|dummy_85|><|dummy_85|><|dummy_85|><|dummy_85|><|dummy_85|><|dummy_85|><|dummy_85|><|dummy_85|><|dummy_85|><|dummy_85|><|dummy_85|><|dummy_85|><|dummy_85|><|dummy_85|><|dummy_85|>"
prehistory,Which of the following indicates a primary context?,the existence of a cache or collection of artifacts found where they were left,"A primary context refers to the original location where an artifact or feature was found, providing direct information about its use and environment.<|dummy_85|>"
high_school_geography,The largest Hindu temple complex ever constructed is found in,Cambodia.,"Angkor Wat, Cambodia.<|dummy_85|><|dummy_85|><|dummy_85|><|dummy_85|><|dummy_85|><|dummy_85|><|dummy_85|><|dummy_85|><|dummy_85|><|dummy_85|><|dummy_85|><|dummy_85|><|dummy_85|><|dummy_85|><|dummy_85|>"
anatomy,In which of the following positions does a patient lie face down?,Erect,Prone position.<|dummy_85|><|dummy_85|><|dummy_85|><|dummy_85|><|dummy_85|><|dummy_85|><|dummy_85|><|dummy_85|><|dummy_85|><|dummy_85|><|dummy_85|><|dummy_85|><|dummy_85|><|dummy_85|><|dummy_85|><|dummy_85|><|dummy_85|>
abstract_algebra,"The element (4, 2) of Z_12 x Z_8 has order",12,24.<|dummy_85|><|dummy_85|><|dummy_85|><|dummy_85|><|dummy_85|><|dummy_85|><|dummy_85|><|dummy_85|><|dummy_85|><|dummy_85|><|dummy_85|><|dummy_85|><|dummy_85|><|dummy_85|><|dummy_85|><|dummy_85|><|dummy_85|><|dummy_85|><|dummy_85|>
world_religions,Which of the following shuns politics?,The sages of the Zhuangzi,The Quakers (Religious Society of Friends) are known for their historical stance of shunning politics.
marketing,What is the term used to describe how consistent or stable the ratings generated by a scale are?,Reliability.,Reliability.<|dummy_85|><|dummy_85|><|dummy_85|><|dummy_85|><|dummy_85|><|dummy_85|><|dummy_85|><|dummy_85|><|dummy_85|><|dummy_85|><|dummy_85|><|dummy_85|><|dummy_85|><|dummy_85|><|dummy_85|><|dummy_85|><|dummy_85|><|dummy_85|>
international_law,Which State ordinarily exercises jurisdiction in respect of crimes committed on board vessels?,The flag State,The flag state of the vessel ordinarily exercises jurisdiction.<|dummy_85|><|dummy_85|><|dummy_85|><|dummy_85|><|dummy_85|><|dummy_85|><|dummy_85|><|dummy_85|><|dummy_85|><|dummy_85|><|dummy_85|>
abstract_algebra,Compute the product in the given ring. (20)(-8) in Z_26,22,The product is 8 in \( \mathbb{Z}_{26} \).<|dummy_85|><|dummy_85|><|dummy_85|><|dummy_85|>
astronomy,Planet X orbits its sun once every 100 Earth days and rotates in the prograde direction around its axis with a sidereal day of 100 Earth days. How long is a solar day on Planet X?,There is no solar day Planet X is tidally locked,A solar day on Planet X is 200 Earth days.<|dummy_85|><|dummy_85|><|dummy_85|><|dummy_85|><|dummy_85|><|dummy_85|><|dummy_85|><|dummy_85|><|dummy_85|>
international_law,What are the criteria for statehood under the 1933 Montevideo Convention?,"It requires a permanent population, a defined territory, a government and a capacity to enter into foreign relations","A defined territory, a permanent population, a government, and the capacity to enter into relations with other states."
marketing,"In the _________ stage in the adoption process, consumers become aware of the new proposition. They have little information and have yet to develop any particular attitudes towards the product. Indeed, at this stage consumers are not interested in finding out any more information.",Knowledge,Awareness stage.<|dummy_85|><|dummy_85|><|dummy_85|><|dummy_85|><|dummy_85|><|dummy_85|><|dummy_85|><|dummy_85|><|dummy_85|><|dummy_85|><|dummy_85|><|dummy_85|><|dummy_85|><|dummy_85|><|dummy_85|><|dummy_85|><|dummy_85|><|dummy_85|>
marketing,Four competing philosophies strongly influence the role of marketing and marketing activities within an organization. Which if the following is not a component of market orientation?,Profitability orientation.,Production orientation.<|dummy_85|><|dummy_85|><|dummy_85|><|dummy_85|><|dummy_85|><|dummy_85|><|dummy_85|><|dummy_85|><|dummy_85|><|dummy_85|><|dummy_85|><|dummy_85|><|dummy_85|><|dummy_85|><|dummy_85|><|dummy_85|><|dummy_85|><|dummy_85|><|dummy_85|>
abstract_algebra,"Statement 1 | If R is a ring and f(x) and g(x) are in R[x], then deg (f(x)+g(x)) = maximum (deg f(x), deg g(x)). Statement 2 | If F is a field then every ideal of F[x] is principal.","False, True",Both statements are true.<|dummy_85|><|dummy_85|><|dummy_85|><|dummy_85|><|dummy_85|><|dummy_85|><|dummy_85|><|dummy_85|><|dummy_85|><|dummy_85|><|dummy_85|><|dummy_85|><|dummy_85|><|dummy_85|><|dummy_85|><|dummy_85|><|dummy_85|>
world_religions,What hours are set aside as the ambrosial hours for the Sikhs?,3–6 a.m.,The ambrosial hours for Sikhs are from 3 AM to 6 AM.<|dummy_85|><|dummy_85|><|dummy_85|><|dummy_85|>
electrical_engineering,Two infinite parallel metal plates are charged with equal surface charge density of the same polarity. The electric field in the gap between the plates is,zero.,zero.<|dummy_85|><|dummy_85|><|dummy_85|><|dummy_85|><|dummy_85|><|dummy_85|><|dummy_85|><|dummy_85|><|dummy_85|><|dummy_85|><|dummy_85|><|dummy_85|><|dummy_85|><|dummy_85|><|dummy_85|><|dummy_85|><|dummy_85|><|dummy_85|><|dummy_85|><|dummy_85|>
anatomy,Smooth muscle cells contain,actin and myosin arranged irregularly.,Actin and myosin filaments for contraction.<|dummy_85|><|dummy_85|><|dummy_85|><|dummy_85|><|dummy_85|><|dummy_85|><|dummy_85|><|dummy_85|><|dummy_85|><|dummy_85|><|dummy_85|>
marketing,Our perception of risk is greater if we are continually reminded of it than if we consider it only at the point of purchase. This is referred to as:,Purchase context.,The availability heuristic.<|dummy_85|><|dummy_85|><|dummy_85|><|dummy_85|><|dummy_85|><|dummy_85|><|dummy_85|><|dummy_85|><|dummy_85|><|dummy_85|><|dummy_85|><|dummy_85|><|dummy_85|><|dummy_85|><|dummy_85|><|dummy_85|><|dummy_85|><|dummy_85|>
high_school_geography,The most rapidly urbanizing area of the world is:,Sub-Saharan Africa,Sub-Saharan Africa.<|dummy_85|><|dummy_85|><|dummy_85|><|dummy_85|><|dummy_85|><|dummy_85|><|dummy_85|><|dummy_85|><|dummy_85|><|dummy_85|><|dummy_85|><|dummy_85|><|dummy_85|><|dummy_85|><|dummy_85|><|dummy_85|><|dummy_85|><|dummy_85|><|dummy_85|><|dummy_85|><|dummy_85|><|dummy_85|>
computer_security,Statement 1| A U2F USB dongle prevents malware on the user’s computer from stealing the user’s second factor to authenticate as that user even when the user’s computer is turned off. Statement 2| A server using U2F can reliably determine that the user who is attempting to login is indeed behind the computer that sent the login request.,"True, False",Statement 1 is true; Statement 2 is false.<|dummy_85|><|dummy_85|><|dummy_85|><|dummy_85|><|dummy_85|><|dummy_85|><|dummy_85|><|dummy_85|><|dummy_85|><|dummy_85|><|dummy_85|><|dummy_85|><|dummy_85|><|dummy_85|>
high_school_geography,Which of the following is an example of a bulk-gaining industry?,Bottled orange juice,"An example of a bulk-gaining industry is the beverage industry, where products like soft drinks are produced and bottled.<|dummy_85|><|dummy_85|><|dummy_85|>"
prehistory,Which of the following is the Pleistocene ice mass in North America centered in the Rocky Mountains?,Cordilleran,The Laurentide Ice Sheet.<|dummy_85|><|dummy_85|><|dummy_85|><|dummy_85|><|dummy_85|><|dummy_85|><|dummy_85|><|dummy_85|><|dummy_85|><|dummy_85|><|dummy_85|><|dummy_85|><|dummy_85|><|dummy_85|><|dummy_85|><|dummy_85|><|dummy_85|><|dummy_85|><|dummy_85|><|dummy_85|>
world_religions,The Communidades de Base is associated with which of the following?,All of the above,Liberation theology.<|dummy_85|><|dummy_85|><|dummy_85|><|dummy_85|><|dummy_85|><|dummy_85|><|dummy_85|><|dummy_85|><|dummy_85|><|dummy_85|><|dummy_85|><|dummy_85|><|dummy_85|><|dummy_85|><|dummy_85|><|dummy_85|><|dummy_85|><|dummy_85|><|dummy_85|><|dummy_85|><|dummy_85|>
high_school_geography,The influence of neo-Malthusianism can be seen in,government programs for birth control and planning.,policies promoting population control and sustainable resource management.<|dummy_85|><|dummy_85|><|dummy_85|><|dummy_85|><|dummy_85|><|dummy_85|><|dummy_85|><|dummy_85|><|dummy_85|><|dummy_85|><|dummy_85|><|dummy_85|><|dummy_85|><|dummy_85|><|dummy_85|><|dummy_85|>
world_religions,"In Buddhism, what are ordained women known as?",Bhikshunis,Ordained women in Buddhism are known as Bhikkhunis.<|dummy_85|><|dummy_85|><|dummy_85|><|dummy_85|><|dummy_85|><|dummy_85|><|dummy_85|><|dummy_85|><|dummy_85|><|dummy_85|><|dummy_85|><|dummy_85|>
prehistory,Which of the following best describes an archaeologist's perspective of culture?,learned and invented adaptations or strategies for survival which are not genetically determined,"An archaeologist views culture as the material remains and artifacts left by past societies, reflecting their behaviors, beliefs, and social structures."
computer_security,What was the first buffer overflow attack?,Morris Worm,The first widely recognized buffer overflow attack was the Morris Worm in 1988.<|dummy_85|><|dummy_85|><|dummy_85|>
computer_security,Public key encryption is advantageous over Symmetric key Cryptography because of,Key exchange,It eliminates the need for secure key exchange.<|dummy_85|><|dummy_85|><|dummy_85|><|dummy_85|><|dummy_85|><|dummy_85|><|dummy_85|><|dummy_85|><|dummy_85|><|dummy_85|>
abstract_algebra,"Statement 1 | If G, H and K are groups of order 4, at least two of them are isomorphic. Statement 2 | If Z_r + Z_s is isomorphic to a subgroup Z_m + Z_n, then r divides m and s divides n.","True, False",Statement 1 is true; Statement 2 is false.<|dummy_85|><|dummy_85|><|dummy_85|><|dummy_85|><|dummy_85|><|dummy_85|><|dummy_85|>
electrical_engineering,"According to the Bohr model, an electron gains or losses energy only by",jumping from one allowed orbit to another.,jumping between discrete energy levels.<|dummy_85|><|dummy_85|><|dummy_85|><|dummy_85|><|dummy_85|><|dummy_85|><|dummy_85|><|dummy_85|><|dummy_85|><|dummy_85|><|dummy_85|><|dummy_85|>
world_religions,"According to Hindu tradition, which age are we in currently?",Kali yuga,"According to Hindu tradition, we are currently in the Kali Yuga.<|dummy_85|><|dummy_85|><|dummy_85|><|dummy_85|>"
international_law,What is an act jure imperii?,An act is jure imperii when undertaken in an official State capacity,An act jure imperii is a sovereign act performed by a state in its governmental capacity.
prehistory,"The New World, “discovered” by Christopher Columbus, was filled with approximately how many people?",tens of millions,Estimates suggest around 54 million people.<|dummy_85|><|dummy_85|><|dummy_85|><|dummy_85|><|dummy_85|><|dummy_85|><|dummy_85|><|dummy_85|><|dummy_85|><|dummy_85|>
anatomy,Which muscles are normally active during quiet inspiration?,External intercostal muscles and diaphragm,Diaphragm and external intercostal muscles.<|dummy_85|><|dummy_85|><|dummy_85|><|dummy_85|><|dummy_85|><|dummy_85|><|dummy_85|><|dummy_85|><|dummy_85|>
computer_security,Which of the following is not an example of presentation layer issues?,Weak or non-existent authentication mechanisms,Network connectivity problems.<|dummy_85|><|dummy_85|><|dummy_85|><|dummy_85|><|dummy_85|><|dummy_85|><|dummy_85|><|dummy_85|><|dummy_85|><|dummy_85|><|dummy_85|><|dummy_85|><|dummy_85|><|dummy_85|><|dummy_85|><|dummy_85|><|dummy_85|><|dummy_85|><|dummy_85|><|dummy_85|><|dummy_85|><|dummy_85|>
astronomy,"Why do jovian planets bulge around the equator that is have a ""squashed"" appearance?",Their rapid rotation flings the mass near the equator outward.,"Jovian planets bulge at the equator due to their rapid rotation, which causes centrifugal force to push material outward."
astronomy,The axis of the Earth is tilted at an angle of approximately ... relative to the orbital plane around the Sun.,23.5 degrees,23.5 degrees.<|dummy_85|><|dummy_85|><|dummy_85|><|dummy_85|><|dummy_85|><|dummy_85|><|dummy_85|><|dummy_85|><|dummy_85|><|dummy_85|><|dummy_85|><|dummy_85|><|dummy_85|><|dummy_85|><|dummy_85|><|dummy_85|><|dummy_85|><|dummy_85|><|dummy_85|><|dummy_85|><|dummy_85|>
prehistory,Archaeology is a subfield of:,anthropology.,Anthropology.<|dummy_85|><|dummy_85|><|dummy_85|><|dummy_85|><|dummy_85|><|dummy_85|><|dummy_85|><|dummy_85|><|dummy_85|><|dummy_85|><|dummy_85|><|dummy_85|><|dummy_85|><|dummy_85|><|dummy_85|><|dummy_85|><|dummy_85|><|dummy_85|><|dummy_85|><|dummy_85|><|dummy_85|><|dummy_85|>
marketing,For a long time commercial media have been used to convey messages designed to develop consumers' attitudes and feelings towards brands. This is referred to as:,Attitudinal response.,Advertising.<|dummy_85|><|dummy_85|><|dummy_85|><|dummy_85|><|dummy_85|><|dummy_85|><|dummy_85|><|dummy_85|><|dummy_85|><|dummy_85|><|dummy_85|><|dummy_85|><|dummy_85|><|dummy_85|><|dummy_85|><|dummy_85|><|dummy_85|><|dummy_85|><|dummy_85|><|dummy_85|><|dummy_85|><|dummy_85|><|dummy_85|><|dummy_85|>
high_school_geography,Which of the following is MOST likely to experience population pressure?,A slash-and-burn agricultural society,A densely populated urban area with limited resources and infrastructure.<|dummy_85|><|dummy_85|><|dummy_85|><|dummy_85|><|dummy_85|><|dummy_85|><|dummy_85|><|dummy_85|><|dummy_85|><|dummy_85|><|dummy_85|><|dummy_85|><|dummy_85|><|dummy_85|><|dummy_85|>
abstract_algebra,"Statement 1 | Every maximal ideal is a prime ideal. Statement 2 | If I is a maximal ideal of a commutative ring R, then R/I is field.","False, False",Both statements are true.<|dummy_85|><|dummy_85|><|dummy_85|><|dummy_85|><|dummy_85|><|dummy_85|><|dummy_85|><|dummy_85|><|dummy_85|><|dummy_85|><|dummy_85|><|dummy_85|><|dummy_85|><|dummy_85|><|dummy_85|><|dummy_85|><|dummy_85|><|dummy_85|><|dummy_85|><|dummy_85|><|dummy_85|>
world_religions,"What is the term for commentary on the Qur'an, which means ""unveiling""?",tafsir,Tafsir.<|dummy_85|><|dummy_85|><|dummy_85|><|dummy_85|><|dummy_85|><|dummy_85|><|dummy_85|><|dummy_85|><|dummy_85|><|dummy_85|><|dummy_85|><|dummy_85|><|dummy_85|><|dummy_85|><|dummy_85|><|dummy_85|><|dummy_85|><|dummy_85|><|dummy_85|><|dummy_85|><|dummy_85|><|dummy_85|>
anatomy,Which of the following muscles initiates elevation of the mandible?,Medial pterygoid.,The masseter muscle initiates elevation of the mandible.<|dummy_85|><|dummy_85|><|dummy_85|><|dummy_85|><|dummy_85|><|dummy_85|><|dummy_85|><|dummy_85|><|dummy_85|><|dummy_85|><|dummy_85|><|dummy_85|><|dummy_85|><|dummy_85|><|dummy_85|><|dummy_85|><|dummy_85|><|dummy_85|><|dummy_85|><|dummy_85|><|dummy_85|><|dummy_85|><|dummy_85|>
world_religions,What is the English title for the divination text also known as the Yijing?,The Classic of Changes,The I Ching or Book of Changes.<|dummy_85|><|dummy_85|><|dummy_85|><|dummy_85|><|dummy_85|><|dummy_85|><|dummy_85|><|dummy_85|><|dummy_85|><|dummy_85|><|dummy_85|><|dummy_85|><|dummy_85|><|dummy_85|><|dummy_85|><|dummy_85|><|dummy_85|><|dummy_85|><|dummy_85|><|dummy_85|><|dummy_85|><|dummy_85|><|dummy_85|><|dummy_85|><|dummy_85|><|dummy_85|>
prehistory,"When did the acquisition of raw materials from greater distances increase, and what does it indicate?",during the Upper Paleolithic; long- distance contacts with greater reliance on trade with distant groups,"The acquisition of raw materials from greater distances increased during the Industrial Revolution, indicating advancements in transportation and global trade networks.<|dummy_85|><|dummy_85|><|dummy_85|><|dummy_85|><|dummy_85|><|dummy_85|><|dummy_85|><|dummy_85|><|dummy_85|><|dummy_85|><|dummy_85|><|dummy_85|>"
computer_security,Message authentication is a service beyond,Message Integrity,"integrity, providing origin authentication and data integrity.<|dummy_85|><|dummy_85|><|dummy_85|><|dummy_85|><|dummy_85|><|dummy_85|><|dummy_85|><|dummy_85|><|dummy_85|><|dummy_85|><|dummy_85|><|dummy_85|><|dummy_85|><|dummy_85|><|dummy_85|><|dummy_85|><|dummy_85|><|dummy_85|><|dummy_85|><|dummy_85|><|dummy_85|><|dummy_85|><|dummy_85|><|dummy_85|><|dummy_85|>"
marketing,"An important characteristic of services is that they are produced and consumed by people, simultaneously, as a single event. One of the outcomes of this unique process is that it is exceedingly difficult to standardize the delivery of services around the blueprint model. Which characteristic of service is this referred to?",Variability.,"This is referred to as the ""inseparability"" characteristic of services.<|dummy_85|><|dummy_85|><|dummy_85|><|dummy_85|><|dummy_85|><|dummy_85|><|dummy_85|><|dummy_85|><|dummy_85|><|dummy_85|><|dummy_85|><|dummy_85|><|dummy_85|><|dummy_85|><|dummy_85|><|dummy_85|><|dummy_85|><|dummy_85|><|dummy_85|>"
computer_security,Which form of encryption does WPA use?,TKIP,WPA uses Temporal Key Integrity Protocol (TKIP) and AES (Advanced Encryption Standard) with CCMP (Counter Mode with Cipher Block Chaining Message Authentication Code Protocol).
anatomy,Emissary veins connect the intracranial venous sinuses to,All of the above areas.,the pterygoid plexus of veins.<|dummy_85|><|dummy_85|><|dummy_85|><|dummy_85|><|dummy_85|><|dummy_85|><|dummy_85|><|dummy_85|><|dummy_85|><|dummy_85|><|dummy_85|><|dummy_85|><|dummy_85|><|dummy_85|><|dummy_85|><|dummy_85|><|dummy_85|><|dummy_85|><|dummy_85|><|dummy_85|><|dummy_85|><|dummy_85|><|dummy_85|><|dummy_85|>
international_law,What was the particular advantage of UNSC Resolution 678 over a collective defensive action under Article 51 UN Charter during the Gulf War?,Resolution 678 is broader because it authorised the use of force with respect to any matter threatening the peace and security of the Gulf region.,"UNSC Resolution 678 authorized member states to use ""all necessary means"" to enforce Iraq's withdrawal from Kuwait, providing a broader mandate than Article 51's self-defense."
international_law,What is the fundamental premise of monist theory?,Monism posits that international and domestic law are part of the same legal order,Monist theory posits that there is only one fundamental substance or principle underlying reality.<|dummy_85|><|dummy_85|><|dummy_85|><|dummy_85|><|dummy_85|><|dummy_85|><|dummy_85|><|dummy_85|><|dummy_85|>
international_law,In the Grootboom case in South Africa the Supreme Court,Found that the state had to take reasonable steps to fulfil its obligation to the appellants under the right to housing in the Constitution,ruled that the government must provide temporary housing to homeless people in extreme need.<|dummy_85|><|dummy_85|><|dummy_85|><|dummy_85|><|dummy_85|><|dummy_85|><|dummy_85|><|dummy_85|><|dummy_85|><|dummy_85|>
prehistory,To which species does Lucy belong?,Australopithecus afarensis,Lucy belongs to the species Australopithecus afarensis.<|dummy_85|><|dummy_85|><|dummy_85|><|dummy_85|><|dummy_85|><|dummy_85|><|dummy_85|><|dummy_85|><|dummy_85|><|dummy_85|>
electrical_engineering,No load saturation characteristics are plotted between,no load voltage and field current,field current and generated voltage.<|dummy_85|><|dummy_85|><|dummy_85|><|dummy_85|><|dummy_85|><|dummy_85|><|dummy_85|><|dummy_85|><|dummy_85|><|dummy_85|><|dummy_85|><|dummy_85|><|dummy_85|><|dummy_85|><|dummy_85|><|dummy_85|><|dummy_85|><|dummy_85|><|dummy_85|><|dummy_85|>
marketing,"________ is the process of marketing accomplished or facilitated via the use of Internet technologies (e.g. web, email, intranet, extranets, etc.).",Internet marketing.,Digital marketing.<|dummy_85|><|dummy_85|><|dummy_85|><|dummy_85|><|dummy_85|><|dummy_85|><|dummy_85|><|dummy_85|><|dummy_85|><|dummy_85|><|dummy_85|><|dummy_85|><|dummy_85|><|dummy_85|><|dummy_85|><|dummy_85|><|dummy_85|><|dummy_85|><|dummy_85|><|dummy_85|><|dummy_85|><|dummy_85|><|dummy_85|>
electrical_engineering,Conductor is static and the field is varying then emf will be induced. This principle is called,static induced emf.,Faraday's Law of Electromagnetic Induction.<|dummy_85|><|dummy_85|><|dummy_85|><|dummy_85|><|dummy_85|><|dummy_85|><|dummy_85|><|dummy_85|><|dummy_85|><|dummy_85|><|dummy_85|><|dummy_85|><|dummy_85|><|dummy_85|><|dummy_85|>
astronomy,Where do most short-period comets come from and how do we know?,The Kuiper belt; short period comets tend to be in the plane of the solar system just like the Kuiper belt.,"Most short-period comets originate from the Kuiper Belt, as evidenced by their orbits and similarities to known Kuiper Belt objects."
marketing,"To evaluate an organization's Strategic Business Units (SBU), the Boston Consulting Group developed a portfolio performance framework that characterizes some of the SBUs as:",Question marks.,"Stars, Cash Cows, Question Marks, and Dogs.<|dummy_85|><|dummy_85|><|dummy_85|><|dummy_85|><|dummy_85|><|dummy_85|><|dummy_85|><|dummy_85|><|dummy_85|><|dummy_85|><|dummy_85|><|dummy_85|><|dummy_85|><|dummy_85|>"
anatomy,Food is prevented from entering the larynx during the pharyngeal phase of swallowing by,constriction of the laryngeal entrance.,the epiglottis closing over the larynx.<|dummy_85|><|dummy_85|><|dummy_85|><|dummy_85|><|dummy_85|><|dummy_85|><|dummy_85|><|dummy_85|><|dummy_85|><|dummy_85|><|dummy_85|><|dummy_85|><|dummy_85|><|dummy_85|><|dummy_85|><|dummy_85|><|dummy_85|>
international_law,What dimension did the Kadi judgment introduce with respect to the incorporation of UN Security Council resolutions?,The Kadi judgment demanded that UNSC resolutions are construed in accordance with human rights,The Kadi judgment introduced the dimension of judicial review of EU measures implementing UN Security Council resolutions for compliance with fundamental rights.<|dummy_85|><|dummy_85|><|dummy_85|><|dummy_85|><|dummy_85|><|dummy_85|>
computer_security,What is a replay attack?,"The attacker resends a captured message, and the site accept its and responds in the attacker's favor",A replay attack is a network attack where valid data transmission is maliciously or fraudulently repeated or delayed.<|dummy_85|><|dummy_85|><|dummy_85|><|dummy_85|><|dummy_85|><|dummy_85|><|dummy_85|><|dummy_85|>
