concept,question,answer,baseline_output
astronomy,What is the source of the material that causes meteor showers?,The nuclei of comets gradually disintegrate and spread out along the comet's orbital path. When the Earth passes through the orbit of a comet we are bombarded by sand-sized particles which cause a meteor shower.,Comet debris or asteroid dust.<|dummy_85|><|dummy_85|><|dummy_85|><|dummy_85|><|dummy_85|><|dummy_85|><|dummy_85|><|dummy_85|><|dummy_85|><|dummy_85|><|dummy_85|><|dummy_85|><|dummy_85|><|dummy_85|><|dummy_85|><|dummy_85|><|dummy_85|><|dummy_85|><|dummy_85|><|dummy_85|>
abstract_algebra,Statement 1 | Every free abelian group is torsion free. Statement 2 | Every finitely generated torsion-free abelian group is a free abelian group.,"True, True",Statement 1 is true; Statement 2 is false.<|dummy_85|><|dummy_85|><|dummy_85|><|dummy_85|><|dummy_85|><|dummy_85|><|dummy_85|><|dummy_85|><|dummy_85|><|dummy_85|><|dummy_85|><|dummy_85|><|dummy_85|><|dummy_85|><|dummy_85|>
high_school_geography,Which one of the following North American associations is NOT correct?,Southern prairie provinces—African Americans,"Without the list of associations provided, I cannot determine which one is incorrect. Please provide the options for a specific answer.<|dummy_85|><|dummy_85|><|dummy_85|>"
electrical_engineering,When checked with an ohm meter an open resistor reads,infinite.,Infinite or very high resistance.<|dummy_85|><|dummy_85|><|dummy_85|><|dummy_85|><|dummy_85|><|dummy_85|><|dummy_85|><|dummy_85|><|dummy_85|><|dummy_85|><|dummy_85|><|dummy_85|><|dummy_85|><|dummy_85|><|dummy_85|><|dummy_85|><|dummy_85|><|dummy_85|><|dummy_85|><|dummy_85|>
abstract_algebra,"Statement 1 | For finite groups G and H, |G + H| = |G||H|. (G + H is the internal direct product.) Statement 2 | If r divides m and s divides n then Z_m + Z_n has a subgroup isomorphic to Z_r + Z_s.","True, True",Both statements are true.<|dummy_85|><|dummy_85|><|dummy_85|><|dummy_85|><|dummy_85|><|dummy_85|><|dummy_85|><|dummy_85|><|dummy_85|><|dummy_85|><|dummy_85|><|dummy_85|><|dummy_85|><|dummy_85|><|dummy_85|><|dummy_85|><|dummy_85|><|dummy_85|><|dummy_85|><|dummy_85|><|dummy_85|><|dummy_85|>
world_religions,What is bhakti often translated as?,Devotion,Devotion or love for a personal god.<|dummy_85|><|dummy_85|><|dummy_85|><|dummy_85|><|dummy_85|><|dummy_85|><|dummy_85|><|dummy_85|><|dummy_85|><|dummy_85|><|dummy_85|><|dummy_85|><|dummy_85|><|dummy_85|><|dummy_85|><|dummy_85|><|dummy_85|><|dummy_85|>
international_law,What are self-executing treaties?,Self-executive treaties are clear and precise enough so as not to require any further implementing measures,Self-executing treaties are international agreements that become enforceable as domestic law without requiring additional legislation.<|dummy_85|><|dummy_85|><|dummy_85|><|dummy_85|><|dummy_85|><|dummy_85|><|dummy_85|><|dummy_85|>
computer_security,"What does it mean to ""be stealthy"" during a penetration test?","Taking care to avoid activities during a penetration test that might attract attention, e.g., by operators or IDS services","To ""be stealthy"" during a penetration test means to avoid detection by the target's security systems and personnel while conducting the test."
prehistory,The fossils originally known as Sinanthropus pekinensis or “Peking Man” are now classified as:,Homo erectus.,Homo erectus pekinensis.<|dummy_85|><|dummy_85|><|dummy_85|><|dummy_85|><|dummy_85|><|dummy_85|><|dummy_85|><|dummy_85|><|dummy_85|><|dummy_85|><|dummy_85|><|dummy_85|><|dummy_85|><|dummy_85|><|dummy_85|><|dummy_85|><|dummy_85|><|dummy_85|><|dummy_85|><|dummy_85|><|dummy_85|><|dummy_85|><|dummy_85|><|dummy_85|><|dummy_85|><|dummy_85|><|dummy_85|>
astronomy,Which of the following is/are common feature(s) of all fresh (i.e. not eroded) impact craters formed on solid surfaces:,A and B only,"A raised rim, a central peak or peak ring, and ejecta blanket.<|dummy_85|><|dummy_85|><|dummy_85|><|dummy_85|><|dummy_85|><|dummy_85|><|dummy_85|><|dummy_85|><|dummy_85|><|dummy_85|><|dummy_85|><|dummy_85|><|dummy_85|><|dummy_85|><|dummy_85|><|dummy_85|><|dummy_85|><|dummy_85|><|dummy_85|>"
prehistory,What was concluded in a recent study comparing the genomes of modern people with ancient skeletal remains in North and South America?,"The separation between native Siberians and the earliest Native Americans occurred sometime between 20,000 and 23,000 years ago.","The study concluded that modern Native Americans have genetic continuity with ancient populations, with some gene flow from European and African sources post-contact.<|dummy_85|><|dummy_85|><|dummy_85|><|dummy_85|><|dummy_85|><|dummy_85|><|dummy_85|><|dummy_85|><|dummy_85|>"
electrical_engineering,"While operating on variable frequency supplies, the AC motor requires variable voltage in order to",avoid effect of saturation.,maintain constant torque across different speeds.<|dummy_85|><|dummy_85|><|dummy_85|><|dummy_85|><|dummy_85|><|dummy_85|><|dummy_85|><|dummy_85|><|dummy_85|><|dummy_85|><|dummy_85|><|dummy_85|><|dummy_85|><|dummy_85|><|dummy_85|><|dummy_85|><|dummy_85|><|dummy_85|><|dummy_85|><|dummy_85|><|dummy_85|><|dummy_85|><|dummy_85|><|dummy_85|><|dummy_85|><|dummy_85|><|dummy_85|>
abstract_algebra,"Statement 1 | A factor group of a non-Abelian group is non-Abelian. Statement 2 | If K is a normal subgroup of H and H is a normal subgroup of G, then K is a normal subgroup of G.","False, False",Statement 1 is false; a factor group of a non-Abelian group can be Abelian. Statement 2 is false; normality is not necessarily transitive.
electrical_engineering,"In an SR latch built from NOR gates, which condition is not allowed","S=1, R=1","Both inputs being high (S=1, R=1) is not allowed.<|dummy_85|><|dummy_85|><|dummy_85|><|dummy_85|><|dummy_85|><|dummy_85|><|dummy_85|><|dummy_85|><|dummy_85|><|dummy_85|><|dummy_85|><|dummy_85|><|dummy_85|><|dummy_85|><|dummy_85|><|dummy_85|><|dummy_85|><|dummy_85|>"
world_religions,What does the term matsuri mean?,Grand festivals,A matsuri is a traditional Japanese festival or celebration.<|dummy_85|><|dummy_85|><|dummy_85|><|dummy_85|><|dummy_85|><|dummy_85|><|dummy_85|><|dummy_85|><|dummy_85|><|dummy_85|><|dummy_85|><|dummy_85|><|dummy_85|><|dummy_85|><|dummy_85|><|dummy_85|><|dummy_85|><|dummy_85|><|dummy_85|><|dummy_85|><|dummy_85|><|dummy_85|><|dummy_85|><|dummy_85|>
computer_security,What are the types of scanning?,"Network, vulnerability, and port","Types of scanning include network scanning, port scanning, vulnerability scanning, wireless scanning, and web application scanning.<|dummy_85|><|dummy_85|><|dummy_85|><|dummy_85|><|dummy_85|><|dummy_85|><|dummy_85|><|dummy_85|><|dummy_85|><|dummy_85|><|dummy_85|><|dummy_85|><|dummy_85|><|dummy_85|>"
electrical_engineering,Which of the following are the disadvantages of a closed loop control system?,All of the above.,"Complexity, higher cost, and potential instability.<|dummy_85|><|dummy_85|><|dummy_85|><|dummy_85|><|dummy_85|><|dummy_85|><|dummy_85|><|dummy_85|><|dummy_85|><|dummy_85|><|dummy_85|><|dummy_85|><|dummy_85|><|dummy_85|><|dummy_85|><|dummy_85|><|dummy_85|><|dummy_85|><|dummy_85|><|dummy_85|><|dummy_85|><|dummy_85|><|dummy_85|><|dummy_85|><|dummy_85|><|dummy_85|><|dummy_85|><|dummy_85|><|dummy_85|><|dummy_85|><|dummy_85|><|dummy_85|><|dummy_85|><|dummy_85|><|dummy_85|><|dummy_85|><|dummy_85|><|dummy_85|><|dummy_85|><|dummy_85|>"
high_school_geography,Which of the following is NOT an example of syncretism?,Hasidic Judaism,A purely traditional religious practice with no external influences.<|dummy_85|><|dummy_85|><|dummy_85|><|dummy_85|><|dummy_85|><|dummy_85|><|dummy_85|><|dummy_85|><|dummy_85|><|dummy_85|><|dummy_85|><|dummy_85|><|dummy_85|><|dummy_85|><|dummy_85|><|dummy_85|><|dummy_85|><|dummy_85|><|dummy_85|><|dummy_85|><|dummy_85|><|dummy_85|><|dummy_85|><|dummy_85|><|dummy_85|><|dummy_85|><|dummy_85|><|dummy_85|><|dummy_85|><|dummy_85|><|dummy_85|><|dummy_85|><|dummy_85|><|dummy_85|><|dummy_85|><|dummy_85|><|dummy_85|><|dummy_85|><|dummy_85|><|dummy_85|>
astronomy,How did Eratosthenes estimate the size of Earth in 240 B.C.?,By comparing the maximum altitude of the Sun in two cities at different latitudes at the same time on the same day.,"Eratosthenes measured Earth's circumference by comparing the angles of the sun's rays at two locations, Syene and Alexandria, during the summer solstice.<|dummy_85|><|dummy_85|><|dummy_85|><|dummy_85|><|dummy_85|><|dummy_85|><|dummy_85|><|dummy_85|><|dummy_85|><|dummy_85|><|dummy_85|><|dummy_85|><|dummy_85|><|dummy_85|><|dummy_85|><|dummy_85|><|dummy_85|>"
astronomy,Which of the following is/are true?,A and D,"Please provide the statements or options you are referring to, and I'll help determine which are true.<|dummy_85|><|dummy_85|><|dummy_85|><|dummy_85|><|dummy_85|><|dummy_85|><|dummy_85|><|dummy_85|><|dummy_85|><|dummy_85|><|dummy_85|><|dummy_85|><|dummy_85|><|dummy_85|><|dummy_85|><|dummy_85|><|dummy_85|><|dummy_85|><|dummy_85|><|dummy_85|><|dummy_85|><|dummy_85|><|dummy_85|><|dummy_85|><|dummy_85|><|dummy_85|><|dummy_85|><|dummy_85|><|dummy_85|><|dummy_85|>"
abstract_algebra,"Statement 1 | If H and K are subgroups of G and one of H or K is normal subgroup of G, then HK is a subgroup of G. Statement 2 | All groups of order p^2 where p is prime are Abelian.","True, True","Both statements are true. Statement 1 is true because if one of the subgroups is normal, the product \( HK \) is a subgroup. Statement 2 is true because all groups of order \( p^2 \) are Abelian."
electrical_engineering,"Lowest critical frequency is due to zero and it may be present at the origin or nearer to the origin, then the type of network is",RL Circuit.,Type 1 or Type 0.<|dummy_85|><|dummy_85|><|dummy_85|><|dummy_85|><|dummy_85|><|dummy_85|><|dummy_85|><|dummy_85|><|dummy_85|><|dummy_85|><|dummy_85|><|dummy_85|><|dummy_85|><|dummy_85|><|dummy_85|><|dummy_85|><|dummy_85|><|dummy_85|><|dummy_85|><|dummy_85|><|dummy_85|><|dummy_85|><|dummy_85|><|dummy_85|><|dummy_85|><|dummy_85|><|dummy_85|><|dummy_85|><|dummy_85|><|dummy_85|><|dummy_85|><|dummy_85|><|dummy_85|><|dummy_85|><|dummy_85|><|dummy_85|><|dummy_85|><|dummy_85|><|dummy_85|><|dummy_85|><|dummy_85|><|dummy_85|>
computer_security,A/an ___________ is a program that steals your logins & passwords for instant messaging applications.,IM – Trojans,Spyware.<|dummy_85|><|dummy_85|><|dummy_85|><|dummy_85|><|dummy_85|><|dummy_85|><|dummy_85|><|dummy_85|><|dummy_85|><|dummy_85|><|dummy_85|><|dummy_85|><|dummy_85|><|dummy_85|><|dummy_85|><|dummy_85|><|dummy_85|><|dummy_85|><|dummy_85|><|dummy_85|><|dummy_85|><|dummy_85|><|dummy_85|><|dummy_85|><|dummy_85|><|dummy_85|><|dummy_85|><|dummy_85|><|dummy_85|><|dummy_85|><|dummy_85|><|dummy_85|><|dummy_85|><|dummy_85|><|dummy_85|><|dummy_85|><|dummy_85|><|dummy_85|><|dummy_85|><|dummy_85|><|dummy_85|><|dummy_85|><|dummy_85|><|dummy_85|><|dummy_85|><|dummy_85|><|dummy_85|>
computer_security,What tool can be used to perform SNMP enumeration?,IP Network Browser,Nmap with the `--script` option for SNMP scripts.<|dummy_85|><|dummy_85|><|dummy_85|><|dummy_85|><|dummy_85|><|dummy_85|><|dummy_85|><|dummy_85|><|dummy_85|><|dummy_85|><|dummy_85|><|dummy_85|><|dummy_85|><|dummy_85|><|dummy_85|><|dummy_85|><|dummy_85|><|dummy_85|><|dummy_85|><|dummy_85|><|dummy_85|><|dummy_85|><|dummy_85|><|dummy_85|><|dummy_85|><|dummy_85|><|dummy_85|><|dummy_85|><|dummy_85|><|dummy_85|><|dummy_85|><|dummy_85|><|dummy_85|><|dummy_85|><|dummy_85|><|dummy_85|><|dummy_85|>
computer_security,How do you prevent SQL injection?,Escape queries,Use parameterized queries or prepared statements.<|dummy_85|><|dummy_85|><|dummy_85|><|dummy_85|><|dummy_85|><|dummy_85|><|dummy_85|><|dummy_85|><|dummy_85|><|dummy_85|><|dummy_85|><|dummy_85|><|dummy_85|><|dummy_85|><|dummy_85|>
high_school_geography,Which one of the following is NOT an advantage of urban agriculture?,Renewed or purified water supplies,Potential for increased pollution and resource competition.<|dummy_85|><|dummy_85|><|dummy_85|><|dummy_85|><|dummy_85|><|dummy_85|><|dummy_85|><|dummy_85|><|dummy_85|><|dummy_85|><|dummy_85|><|dummy_85|><|dummy_85|><|dummy_85|><|dummy_85|>
astronomy,The two moons of Mars are called ...,Phobos and Deimos,Phobos and Deimos.<|dummy_85|><|dummy_85|><|dummy_85|><|dummy_85|><|dummy_85|><|dummy_85|><|dummy_85|><|dummy_85|><|dummy_85|><|dummy_85|><|dummy_85|><|dummy_85|><|dummy_85|><|dummy_85|><|dummy_85|><|dummy_85|>
world_religions,What type of Buddhist organization is the Bodu Bala Sena?,Activist and militant organization in Sri Lanka,The Bodu Bala Sena is a Sinhalese Buddhist nationalist organization in Sri Lanka.<|dummy_85|><|dummy_85|><|dummy_85|>
computer_security,"Why apps developed in languages like C, C++ is prone to Buffer-overflow?",No string boundary checks in predefined functions,"C and C++ lack built-in bounds checking for arrays and pointers, allowing direct memory access.<|dummy_85|><|dummy_85|><|dummy_85|><|dummy_85|>"
prehistory,"The Bering Strait was above water, on and off, between","35,000 and 11,000 B.P.","2.5 million and 13,000 years ago.<|dummy_85|><|dummy_85|><|dummy_85|><|dummy_85|><|dummy_85|><|dummy_85|><|dummy_85|><|dummy_85|><|dummy_85|><|dummy_85|><|dummy_85|>"
electrical_engineering,"Length of the cable is doubled, its capacitance C will be",doubled.,Halved.<|dummy_85|><|dummy_85|><|dummy_85|><|dummy_85|><|dummy_85|><|dummy_85|><|dummy_85|><|dummy_85|><|dummy_85|><|dummy_85|><|dummy_85|><|dummy_85|><|dummy_85|><|dummy_85|><|dummy_85|><|dummy_85|><|dummy_85|><|dummy_85|><|dummy_85|><|dummy_85|>
anatomy,Which of one of the following statements about the postnatal growth of the maxilla is correct?,The zygomaticomaxillary sutures contribute to increase in height and length of the maxilla,"The maxilla grows primarily through remodeling and displacement, influenced by the growth of the cranial base and surrounding structures."
international_law,Which of the following types of rights have been described as first generation rights?,Civil and political rights,Civil and political rights.<|dummy_85|><|dummy_85|><|dummy_85|><|dummy_85|><|dummy_85|><|dummy_85|><|dummy_85|><|dummy_85|><|dummy_85|><|dummy_85|><|dummy_85|><|dummy_85|><|dummy_85|><|dummy_85|><|dummy_85|><|dummy_85|><|dummy_85|><|dummy_85|><|dummy_85|><|dummy_85|>
world_religions,What is the name of the Hindu community associated with environmental activism?,Bishnoi,The Bishnoi community.<|dummy_85|><|dummy_85|><|dummy_85|><|dummy_85|><|dummy_85|><|dummy_85|><|dummy_85|><|dummy_85|><|dummy_85|><|dummy_85|><|dummy_85|><|dummy_85|><|dummy_85|><|dummy_85|><|dummy_85|><|dummy_85|><|dummy_85|><|dummy_85|>
world_religions,How many books are in the New Testament?,27,There are 27 books in the New Testament.<|dummy_85|><|dummy_85|><|dummy_85|><|dummy_85|><|dummy_85|><|dummy_85|><|dummy_85|><|dummy_85|><|dummy_85|><|dummy_85|><|dummy_85|><|dummy_85|><|dummy_85|><|dummy_85|><|dummy_85|>
astronomy,Which factor s most important in determining the history of volanism and tectonism on a planet?,size of the planet,The planet's size and composition.<|dummy_85|><|dummy_85|><|dummy_85|><|dummy_85|><|dummy_85|><|dummy_85|><|dummy_85|><|dummy_85|><|dummy_85|><|dummy_85|><|dummy_85|><|dummy_85|><|dummy_85|><|dummy_85|><|dummy_85|><|dummy_85|><|dummy_85|><|dummy_85|>
astronomy,How do scientists know that the majority of meteorites come from the asteroid belt?,The spectra of some meteorites are similar to the spectra of asteroids in the asteroid belt.,"Scientists know this because meteorites' compositions match those of asteroids in the belt, and their orbits often intersect Earth's orbit."
international_law,Are the provisional measures issued by the ICJ binding upon the parties?,"Yes, it has been consistently held by the Court since the La Grand case (2001) that they are binding","Yes, provisional measures issued by the ICJ are binding upon the parties.<|dummy_85|><|dummy_85|><|dummy_85|><|dummy_85|><|dummy_85|><|dummy_85|><|dummy_85|><|dummy_85|><|dummy_85|><|dummy_85|>"
international_law,What other criteria were imposed by the Badinter Commission on the former Yugoslav republics?,The Commission required a commitment to human rights and democracy,"The Badinter Commission required respect for human rights, protection of minorities, and peaceful relations with neighbors.<|dummy_85|><|dummy_85|><|dummy_85|><|dummy_85|><|dummy_85|>"
astronomy,What does the astronomical term ecliptic describe?,The path of the Sun in the sky throughout a year.,The ecliptic is the apparent path of the Sun across the sky over the course of a year.<|dummy_85|><|dummy_85|><|dummy_85|><|dummy_85|>
marketing,A probability sample constructed so that randomly selected sub-samples of different groups are represented in the total sample is called a:,Stratified sample.,Stratified random sample.<|dummy_85|><|dummy_85|><|dummy_85|><|dummy_85|><|dummy_85|><|dummy_85|><|dummy_85|><|dummy_85|><|dummy_85|><|dummy_85|><|dummy_85|><|dummy_85|><|dummy_85|><|dummy_85|><|dummy_85|><|dummy_85|><|dummy_85|><|dummy_85|><|dummy_85|><|dummy_85|><|dummy_85|><|dummy_85|><|dummy_85|><|dummy_85|><|dummy_85|><|dummy_85|><|dummy_85|><|dummy_85|><|dummy_85|><|dummy_85|><|dummy_85|><|dummy_85|><|dummy_85|><|dummy_85|><|dummy_85|><|dummy_85|><|dummy_85|><|dummy_85|><|dummy_85|><|dummy_85|><|dummy_85|><|dummy_85|><|dummy_85|><|dummy_85|><|dummy_85|><|dummy_85|><|dummy_85|><|dummy_85|><|dummy_85|><|dummy_85|><|dummy_85|><|dummy_85|><|dummy_85|><|dummy_85|><|dummy_85|><|dummy_85|><|dummy_85|>
high_school_geography,Which structure(s) traditionally occupies the center of a historic Asian city?,A religious building,"A palace, temple, or central market square.<|dummy_85|><|dummy_85|><|dummy_85|><|dummy_85|><|dummy_85|><|dummy_85|><|dummy_85|><|dummy_85|><|dummy_85|><|dummy_85|><|dummy_85|><|dummy_85|><|dummy_85|><|dummy_85|><|dummy_85|><|dummy_85|><|dummy_85|><|dummy_85|><|dummy_85|><|dummy_85|><|dummy_85|><|dummy_85|><|dummy_85|><|dummy_85|><|dummy_85|><|dummy_85|><|dummy_85|><|dummy_85|><|dummy_85|><|dummy_85|><|dummy_85|><|dummy_85|><|dummy_85|><|dummy_85|><|dummy_85|><|dummy_85|><|dummy_85|><|dummy_85|><|dummy_85|><|dummy_85|><|dummy_85|><|dummy_85|><|dummy_85|><|dummy_85|><|dummy_85|><|dummy_85|><|dummy_85|><|dummy_85|><|dummy_85|><|dummy_85|><|dummy_85|><|dummy_85|><|dummy_85|>"
computer_security,Which of the following is not a block cipher operating mode?,CBF,"ECB (Electronic Codebook) is a block cipher operating mode, but if you're looking for one that is not, consider ""CBC"" (Cipher Block Chaining), ""CFB"" (Cipher Feedback), ""OFB"" (Output Feedback), ""CTR"" (Counter), and ""GCM"" (G"
prehistory,How did Aurignacian technology differ from Mousterian technology?,Aurignacian technology produced more usable blade surface.,"Aurignacian technology featured blade tools and bone artifacts, while Mousterian technology primarily used flake tools.<|dummy_85|><|dummy_85|><|dummy_85|><|dummy_85|><|dummy_85|><|dummy_85|><|dummy_85|><|dummy_85|><|dummy_85|><|dummy_85|><|dummy_85|><|dummy_85|><|dummy_85|><|dummy_85|><|dummy_85|><|dummy_85|><|dummy_85|><|dummy_85|><|dummy_85|><|dummy_85|><|dummy_85|><|dummy_85|><|dummy_85|><|dummy_85|><|dummy_85|><|dummy_85|><|dummy_85|><|dummy_85|><|dummy_85|><|dummy_85|><|dummy_85|><|dummy_85|><|dummy_85|><|dummy_85|><|dummy_85|><|dummy_85|><|dummy_85|><|dummy_85|><|dummy_85|>"
world_religions,When was the State of Israel established?,1948,"The State of Israel was established on May 14, 1948.<|dummy_85|><|dummy_85|><|dummy_85|><|dummy_85|><|dummy_85|><|dummy_85|><|dummy_85|><|dummy_85|><|dummy_85|><|dummy_85|><|dummy_85|><|dummy_85|><|dummy_85|><|dummy_85|><|dummy_85|><|dummy_85|><|dummy_85|><|dummy_85|><|dummy_85|><|dummy_85|><|dummy_85|><|dummy_85|><|dummy_85|><|dummy_85|><|dummy_85|><|dummy_85|><|dummy_85|><|dummy_85|><|dummy_85|><|dummy_85|><|dummy_85|><|dummy_85|><|dummy_85|><|dummy_85|><|dummy_85|><|dummy_85|><|dummy_85|><|dummy_85|><|dummy_85|><|dummy_85|><|dummy_85|><|dummy_85|><|dummy_85|><|dummy_85|><|dummy_85|><|dummy_85|><|dummy_85|><|dummy_85|>"
marketing,"The development of social media has enabled individuals to communicate with organizations, communities, friends, and family. The content of the message can be about brands, experiences, or events, and is developed and shared by individuals. This is referred to as:",User-generated content.,User-generated content (UGC).<|dummy_85|><|dummy_85|><|dummy_85|><|dummy_85|><|dummy_85|><|dummy_85|><|dummy_85|><|dummy_85|><|dummy_85|><|dummy_85|><|dummy_85|><|dummy_85|><|dummy_85|><|dummy_85|><|dummy_85|><|dummy_85|><|dummy_85|><|dummy_85|><|dummy_85|><|dummy_85|><|dummy_85|><|dummy_85|><|dummy_85|><|dummy_85|><|dummy_85|><|dummy_85|><|dummy_85|><|dummy_85|><|dummy_85|><|dummy_85|><|dummy_85|><|dummy_85|><|dummy_85|><|dummy_85|><|dummy_85|><|dummy_85|><|dummy_85|><|dummy_85|><|dummy_85|><|dummy_85|><|dummy_85|><|dummy_85|><|dummy_85|><|dummy_85|><|dummy_85|><|dummy_85|><|dummy_85|><|dummy_85|><|dummy_85|><|dummy_85|><|dummy_85|><|dummy_85|><|dummy_85|><|dummy_85|><|dummy_85|><|dummy_85|><|dummy_85|>
marketing,"These are stores designed to kill off the competition and are characterized by narrow but very deep product assortment, low prices, and few to moderate customer services:",Category-killer stores.,Category killers.<|dummy_85|><|dummy_85|><|dummy_85|><|dummy_85|><|dummy_85|><|dummy_85|><|dummy_85|><|dummy_85|><|dummy_85|><|dummy_85|><|dummy_85|><|dummy_85|><|dummy_85|><|dummy_85|><|dummy_85|><|dummy_85|><|dummy_85|><|dummy_85|><|dummy_85|><|dummy_85|><|dummy_85|><|dummy_85|><|dummy_85|><|dummy_85|><|dummy_85|><|dummy_85|><|dummy_85|><|dummy_85|><|dummy_85|><|dummy_85|><|dummy_85|><|dummy_85|><|dummy_85|><|dummy_85|><|dummy_85|><|dummy_85|><|dummy_85|><|dummy_85|><|dummy_85|><|dummy_85|><|dummy_85|><|dummy_85|><|dummy_85|><|dummy_85|><|dummy_85|><|dummy_85|><|dummy_85|><|dummy_85|><|dummy_85|><|dummy_85|><|dummy_85|><|dummy_85|><|dummy_85|><|dummy_85|><|dummy_85|><|dummy_85|><|dummy_85|><|dummy_85|><|dummy_85|><|dummy_85|>
prehistory,"Tiwanaku, with its capital at Titicaca, was one of the ___________ kingdoms of the ancient world.",highest,Andean civilizations.<|dummy_85|><|dummy_85|><|dummy_85|><|dummy_85|><|dummy_85|><|dummy_85|><|dummy_85|><|dummy_85|><|dummy_85|><|dummy_85|><|dummy_85|><|dummy_85|><|dummy_85|><|dummy_85|><|dummy_85|><|dummy_85|><|dummy_85|><|dummy_85|><|dummy_85|><|dummy_85|><|dummy_85|><|dummy_85|><|dummy_85|><|dummy_85|><|dummy_85|><|dummy_85|><|dummy_85|><|dummy_85|><|dummy_85|><|dummy_85|><|dummy_85|><|dummy_85|><|dummy_85|><|dummy_85|><|dummy_85|><|dummy_85|><|dummy_85|><|dummy_85|><|dummy_85|><|dummy_85|><|dummy_85|><|dummy_85|><|dummy_85|><|dummy_85|><|dummy_85|><|dummy_85|><|dummy_85|><|dummy_85|><|dummy_85|><|dummy_85|><|dummy_85|><|dummy_85|><|dummy_85|><|dummy_85|><|dummy_85|><|dummy_85|><|dummy_85|><|dummy_85|><|dummy_85|>
marketing,"In marketing, the term proposition:",Is a broad concept that encompasses the satisfaction of consumer needs.,A statement of the unique value or benefit a product or service offers to customers.<|dummy_85|><|dummy_85|><|dummy_85|><|dummy_85|><|dummy_85|><|dummy_85|><|dummy_85|><|dummy_85|><|dummy_85|><|dummy_85|><|dummy_85|><|dummy_85|><|dummy_85|><|dummy_85|><|dummy_85|><|dummy_85|><|dummy_85|><|dummy_85|><|dummy_85|><|dummy_85|><|dummy_85|><|dummy_85|><|dummy_85|>
anatomy,"When you examine a patient who has suffered an unfavourable fracture of the body of the mandible, you would expect the",anterior fragment to be displaced downwards by the action of the digastric muscle.,"fracture line to be palpable and possibly visible, with potential malocclusion and swelling.<|dummy_85|><|dummy_85|><|dummy_85|><|dummy_85|><|dummy_85|><|dummy_85|><|dummy_85|><|dummy_85|><|dummy_85|><|dummy_85|><|dummy_85|><|dummy_85|><|dummy_85|><|dummy_85|><|dummy_85|><|dummy_85|><|dummy_85|><|dummy_85|><|dummy_85|>"
electrical_engineering,A long wire composed of a smooth round conductor runs above and parallel to the ground (assumed to be a large conducting plane). A high voltage exists between the conductor and the ground. The maximum electric stress occurs at,lower surface of the conductor.,the surface of the conductor closest to the ground.<|dummy_85|><|dummy_85|><|dummy_85|><|dummy_85|><|dummy_85|><|dummy_85|><|dummy_85|><|dummy_85|><|dummy_85|><|dummy_85|><|dummy_85|><|dummy_85|><|dummy_85|><|dummy_85|><|dummy_85|><|dummy_85|><|dummy_85|><|dummy_85|><|dummy_85|><|dummy_85|><|dummy_85|><|dummy_85|><|dummy_85|><|dummy_85|><|dummy_85|><|dummy_85|><|dummy_85|><|dummy_85|><|dummy_85|>
marketing,The pricing approach where prices are set based on what customers believe to offer value is called the:,Value-oriented approach.,Value-based pricing.<|dummy_85|><|dummy_85|><|dummy_85|><|dummy_85|><|dummy_85|><|dummy_85|><|dummy_85|><|dummy_85|><|dummy_85|><|dummy_85|><|dummy_85|><|dummy_85|><|dummy_85|><|dummy_85|><|dummy_85|><|dummy_85|><|dummy_85|><|dummy_85|><|dummy_85|><|dummy_85|><|dummy_85|><|dummy_85|><|dummy_85|><|dummy_85|><|dummy_85|><|dummy_85|><|dummy_85|><|dummy_85|><|dummy_85|><|dummy_85|><|dummy_85|><|dummy_85|><|dummy_85|><|dummy_85|><|dummy_85|>
astronomy,The International Space Station (ISS) circles the Earth approximately 410 km above the ground. Find the best estimate for the orbital speed of the ISS:,28000 km/h,Approximately 7.66 kilometers per second.<|dummy_85|><|dummy_85|><|dummy_85|><|dummy_85|><|dummy_85|><|dummy_85|><|dummy_85|><|dummy_85|><|dummy_85|><|dummy_85|><|dummy_85|><|dummy_85|><|dummy_85|><|dummy_85|><|dummy_85|><|dummy_85|><|dummy_85|><|dummy_85|><|dummy_85|><|dummy_85|><|dummy_85|><|dummy_85|><|dummy_85|><|dummy_85|><|dummy_85|><|dummy_85|><|dummy_85|><|dummy_85|><|dummy_85|>
