concept,question,answer,baseline_output
electrical_engineering,How many entries will be in the truth table of a 3 input NAND gate ?,8,Eight entries.<|dummy_85|><|dummy_85|><|dummy_85|><|dummy_85|><|dummy_85|><|dummy_85|><|dummy_85|><|dummy_85|><|dummy_85|><|dummy_85|><|dummy_85|><|dummy_85|><|dummy_85|><|dummy_85|><|dummy_85|><|dummy_85|><|dummy_85|><|dummy_85|><|dummy_85|><|dummy_85|><|dummy_85|><|dummy_85|><|dummy_85|><|dummy_85|><|dummy_85|><|dummy_85|><|dummy_85|><|dummy_85|><|dummy_85|><|dummy_85|><|dummy_85|><|dummy_85|><|dummy_85|><|dummy_85|><|dummy_85|><|dummy_85|><|dummy_85|><|dummy_85|><|dummy_85|><|dummy_85|><|dummy_85|><|dummy_85|><|dummy_85|><|dummy_85|><|dummy_85|><|dummy_85|><|dummy_85|><|dummy_85|><|dummy_85|><|dummy_85|><|dummy_85|><|dummy_85|><|dummy_85|><|dummy_85|><|dummy_85|><|dummy_85|><|dummy_85|><|dummy_85|><|dummy_85|><|dummy_85|>
prehistory,"The earthen monument called Mound 72 contained the burials of more than 270 people, including an adult male interred on a platform with 20,000 conch-shell beads in the shape of a giant bird. Mound 72 represents the most complex ______ society at ________.",Mississippian; Cahokia,Mound 72 represents the most complex Mississippian society at Cahokia.<|dummy_85|><|dummy_85|><|dummy_85|><|dummy_85|><|dummy_85|><|dummy_85|><|dummy_85|><|dummy_85|><|dummy_85|><|dummy_85|><|dummy_85|><|dummy_85|><|dummy_85|><|dummy_85|><|dummy_85|><|dummy_85|><|dummy_85|><|dummy_85|><|dummy_85|><|dummy_85|><|dummy_85|><|dummy_85|><|dummy_85|><|dummy_85|><|dummy_85|><|dummy_85|><|dummy_85|><|dummy_85|><|dummy_85|><|dummy_85|><|dummy_85|><|dummy_85|><|dummy_85|><|dummy_85|><|dummy_85|><|dummy_85|><|dummy_85|><|dummy_85|><|dummy_85|><|dummy_85|><|dummy_85|><|dummy_85|><|dummy_85|><|dummy_85|><|dummy_85|><|dummy_85|>
computer_security,"Assume that a TLS connection has been established successfully between a client and a server. Establishing the session included checking the server certificate and executing a DiffieHelmann exchange, but the client did not provide a client certificate. Further, assume that the client and server are honest, that the client and server don’t leak their keys, and that the cryptography is good. Which of the following attacks does TLS protect against?
1. An attacker replaying bytes that a client sent earlier.
2. An attacker impersonating the server.","True, True",TLS protects against both: 1. replay attacks and 2. server impersonation.<|dummy_85|><|dummy_85|><|dummy_85|><|dummy_85|><|dummy_85|><|dummy_85|><|dummy_85|><|dummy_85|><|dummy_85|><|dummy_85|><|dummy_85|><|dummy_85|><|dummy_85|><|dummy_85|><|dummy_85|><|dummy_85|><|dummy_85|><|dummy_85|><|dummy_85|><|dummy_85|><|dummy_85|><|dummy_85|><|dummy_85|><|dummy_85|><|dummy_85|><|dummy_85|><|dummy_85|><|dummy_85|><|dummy_85|><|dummy_85|><|dummy_85|><|dummy_85|><|dummy_85|><|dummy_85|><|dummy_85|><|dummy_85|><|dummy_85|><|dummy_85|><|dummy_85|><|dummy_85|><|dummy_85|><|dummy_85|><|dummy_85|><|dummy_85|><|dummy_85|>
abstract_algebra,"Using Fermat's theorem, find the remainder of 3^47 when it is divided by 23.",4,"The remainder is 6. 

Using Fermat's Little Theorem, since 23 is prime, \(3^{22} \equiv 1 \pmod{23}\). Thus, \(3^{47} = 3^{2 \times 22 + 3} = (3^{22})^"
marketing,"In the history of marketing, when did the production period end?",In the 1920s.,The production period in marketing history is generally considered to have ended in the 1920s.<|dummy_85|><|dummy_85|><|dummy_85|><|dummy_85|><|dummy_85|><|dummy_85|><|dummy_85|><|dummy_85|><|dummy_85|><|dummy_85|><|dummy_85|><|dummy_85|><|dummy_85|><|dummy_85|><|dummy_85|><|dummy_85|><|dummy_85|><|dummy_85|><|dummy_85|><|dummy_85|><|dummy_85|><|dummy_85|><|dummy_85|><|dummy_85|><|dummy_85|><|dummy_85|><|dummy_85|><|dummy_85|><|dummy_85|><|dummy_85|><|dummy_85|><|dummy_85|><|dummy_85|><|dummy_85|><|dummy_85|><|dummy_85|><|dummy_85|><|dummy_85|><|dummy_85|><|dummy_85|><|dummy_85|><|dummy_85|><|dummy_85|><|dummy_85|>
computer_security,"When a wireless user authenticates to any AP, both of them go in the course of four-step authentication progression which is called _____________",4-way handshake,802.1X authentication.<|dummy_85|><|dummy_85|><|dummy_85|><|dummy_85|><|dummy_85|><|dummy_85|><|dummy_85|><|dummy_85|><|dummy_85|><|dummy_85|><|dummy_85|><|dummy_85|><|dummy_85|><|dummy_85|><|dummy_85|>
prehistory,The possibility that Homo erectus possessed an aesthetic sense and may have created “art” is suggested by:,recovery of a shell at the Trinil site with an intentionally engraved series of lines.,The discovery of ochre with geometric engravings at the South African site of Blombos Cave.
high_school_geography,Which type of economic activity is most closely tied to the physical environment?,Primary,"Primary economic activities, such as agriculture, mining, and fishing.<|dummy_85|><|dummy_85|><|dummy_85|><|dummy_85|><|dummy_85|><|dummy_85|><|dummy_85|><|dummy_85|>"
astronomy,The nebular theory of the formation of the solar system successfully predicts all but one of the following. Which one does the theory not predict?,the equal number of terrestrial and jovian planets,The presence of hot Jupiters.<|dummy_85|><|dummy_85|><|dummy_85|><|dummy_85|><|dummy_85|><|dummy_85|><|dummy_85|><|dummy_85|><|dummy_85|><|dummy_85|><|dummy_85|><|dummy_85|>
world_religions,Which elephant-headed Hindu deity is often described as the most beloved?,Ganesha,Ganesha.<|dummy_85|><|dummy_85|><|dummy_85|><|dummy_85|><|dummy_85|><|dummy_85|><|dummy_85|><|dummy_85|><|dummy_85|><|dummy_85|><|dummy_85|><|dummy_85|><|dummy_85|><|dummy_85|><|dummy_85|><|dummy_85|><|dummy_85|>
prehistory,Which structures housed religious ceremonies?,kivas,"Temples, churches, mosques, synagogues, and other places of worship.<|dummy_85|><|dummy_85|><|dummy_85|><|dummy_85|>"
world_religions,"Zhuangzi describes a state as ziran, which means which of the following?",Spontaneity,Spontaneity or naturalness.<|dummy_85|><|dummy_85|><|dummy_85|><|dummy_85|><|dummy_85|><|dummy_85|><|dummy_85|><|dummy_85|><|dummy_85|><|dummy_85|><|dummy_85|><|dummy_85|><|dummy_85|>
world_religions,The classic text Daodejing is known by what title in English?,Classic of the Way and Power,The Tao Te Ching.<|dummy_85|><|dummy_85|><|dummy_85|><|dummy_85|><|dummy_85|><|dummy_85|><|dummy_85|><|dummy_85|><|dummy_85|><|dummy_85|><|dummy_85|><|dummy_85|><|dummy_85|><|dummy_85|><|dummy_85|>
computer_security,A session symmetric key between two parties is used,Only once,For secure communication during a single session.<|dummy_85|><|dummy_85|><|dummy_85|><|dummy_85|><|dummy_85|><|dummy_85|><|dummy_85|><|dummy_85|><|dummy_85|><|dummy_85|><|dummy_85|><|dummy_85|><|dummy_85|><|dummy_85|><|dummy_85|><|dummy_85|><|dummy_85|><|dummy_85|><|dummy_85|><|dummy_85|><|dummy_85|><|dummy_85|><|dummy_85|><|dummy_85|><|dummy_85|><|dummy_85|><|dummy_85|><|dummy_85|><|dummy_85|><|dummy_85|><|dummy_85|><|dummy_85|>
electrical_engineering,LC oscillators are used for produce a waveform with frequency ranging from,1MHz to 500 MHz,A few kilohertz to several gigahertz.<|dummy_85|><|dummy_85|><|dummy_85|><|dummy_85|><|dummy_85|><|dummy_85|><|dummy_85|><|dummy_85|><|dummy_85|><|dummy_85|><|dummy_85|><|dummy_85|><|dummy_85|><|dummy_85|><|dummy_85|><|dummy_85|><|dummy_85|><|dummy_85|><|dummy_85|><|dummy_85|><|dummy_85|><|dummy_85|><|dummy_85|><|dummy_85|><|dummy_85|><|dummy_85|><|dummy_85|><|dummy_85|><|dummy_85|>
abstract_algebra,Find all zeros in the indicated finite field of the given polynomial with coefficients in that field. x^3 + 2x + 2 in Z_7,"2,3",The zeros of \(x^3 + 2x + 2\) in \(\mathbb{Z}_7\) are \(x = 3\) and \(x = 5\).
marketing,Which of the following is not one of the categories of research design?,Desk research.,"""Experimental"" is not a category of research design; rather, it is a type of research method within the broader categories of experimental, quasi-experimental, and non-experimental designs.<|dummy_85|><|dummy_85|><|dummy_85|>"
anatomy,Patients with which of the following diseases are treated with injections of vitamin B-12?,Pernicious anemia,Patients with pernicious anemia are treated with injections of vitamin B-12.<|dummy_85|><|dummy_85|><|dummy_85|><|dummy_85|><|dummy_85|><|dummy_85|><|dummy_85|><|dummy_85|><|dummy_85|><|dummy_85|><|dummy_85|><|dummy_85|><|dummy_85|><|dummy_85|><|dummy_85|><|dummy_85|><|dummy_85|><|dummy_85|><|dummy_85|><|dummy_85|><|dummy_85|><|dummy_85|><|dummy_85|>
marketing,"________________reflect a purchaser's high level of involvement in the purchase decision. There is high perceived risk in these decisions so consumers spend a great deal of time, care, and energy searching, formulating, and making the final decision.",Durable goods.,High-involvement purchases.<|dummy_85|><|dummy_85|><|dummy_85|><|dummy_85|><|dummy_85|><|dummy_85|><|dummy_85|><|dummy_85|><|dummy_85|><|dummy_85|><|dummy_85|><|dummy_85|><|dummy_85|><|dummy_85|><|dummy_85|><|dummy_85|><|dummy_85|><|dummy_85|><|dummy_85|><|dummy_85|><|dummy_85|><|dummy_85|><|dummy_85|><|dummy_85|><|dummy_85|><|dummy_85|><|dummy_85|><|dummy_85|><|dummy_85|><|dummy_85|><|dummy_85|><|dummy_85|><|dummy_85|><|dummy_85|>
international_law,What types of force does Article 2(4) of the UN Charter prohibit?,Article 2(4) encompasses only armed force,Article 2(4) of the UN Charter prohibits the threat or use of force against the territorial integrity or political independence of any state.<|dummy_85|><|dummy_85|><|dummy_85|><|dummy_85|><|dummy_85|><|dummy_85|><|dummy_85|><|dummy_85|><|dummy_85|><|dummy_85|><|dummy_85|><|dummy_85|>
world_religions,How many female renouncers were under the tutelage of Chandanbala?,"36,000",Chandanbala had 36 female renouncers under her tutelage.<|dummy_85|><|dummy_85|><|dummy_85|><|dummy_85|><|dummy_85|><|dummy_85|><|dummy_85|><|dummy_85|><|dummy_85|><|dummy_85|><|dummy_85|><|dummy_85|><|dummy_85|><|dummy_85|><|dummy_85|><|dummy_85|><|dummy_85|><|dummy_85|><|dummy_85|><|dummy_85|><|dummy_85|><|dummy_85|><|dummy_85|><|dummy_85|>
astronomy,How did the lunar maria form?,Large impacts fractured the Moon's lithosphere allowing lava to fill the impact basins.,The lunar maria formed from ancient volcanic eruptions that filled large basins with basaltic lava.<|dummy_85|><|dummy_85|><|dummy_85|><|dummy_85|><|dummy_85|><|dummy_85|><|dummy_85|><|dummy_85|><|dummy_85|><|dummy_85|><|dummy_85|><|dummy_85|><|dummy_85|><|dummy_85|><|dummy_85|><|dummy_85|><|dummy_85|><|dummy_85|><|dummy_85|><|dummy_85|><|dummy_85|><|dummy_85|><|dummy_85|><|dummy_85|><|dummy_85|><|dummy_85|><|dummy_85|><|dummy_85|><|dummy_85|><|dummy_85|><|dummy_85|><|dummy_85|><|dummy_85|><|dummy_85|><|dummy_85|><|dummy_85|><|dummy_85|><|dummy_85|><|dummy_85|><|dummy_85|><|dummy_85|><|dummy_85|>
computer_security,Which Nmap scan is does not completely open a TCP connection?,SYN stealth scan,The SYN scan (or half-open scan).<|dummy_85|><|dummy_85|><|dummy_85|><|dummy_85|><|dummy_85|><|dummy_85|><|dummy_85|><|dummy_85|><|dummy_85|><|dummy_85|><|dummy_85|><|dummy_85|><|dummy_85|><|dummy_85|><|dummy_85|><|dummy_85|><|dummy_85|><|dummy_85|><|dummy_85|><|dummy_85|><|dummy_85|><|dummy_85|><|dummy_85|><|dummy_85|><|dummy_85|><|dummy_85|><|dummy_85|><|dummy_85|><|dummy_85|><|dummy_85|><|dummy_85|><|dummy_85|><|dummy_85|><|dummy_85|><|dummy_85|><|dummy_85|><|dummy_85|><|dummy_85|><|dummy_85|><|dummy_85|><|dummy_85|><|dummy_85|><|dummy_85|><|dummy_85|><|dummy_85|><|dummy_85|><|dummy_85|><|dummy_85|><|dummy_85|><|dummy_85|><|dummy_85|><|dummy_85|><|dummy_85|><|dummy_85|>
international_law,What is the fundamental prerequisite for the incorporation of custom under English law?,Custom is incorporated if it is not in conflict with existing legislation,"Long-standing, consistent, and general practice accepted as legally binding.<|dummy_85|><|dummy_85|><|dummy_85|><|dummy_85|><|dummy_85|><|dummy_85|><|dummy_85|><|dummy_85|><|dummy_85|><|dummy_85|><|dummy_85|><|dummy_85|><|dummy_85|><|dummy_85|><|dummy_85|><|dummy_85|><|dummy_85|><|dummy_85|><|dummy_85|><|dummy_85|><|dummy_85|><|dummy_85|><|dummy_85|><|dummy_85|><|dummy_85|><|dummy_85|><|dummy_85|><|dummy_85|><|dummy_85|><|dummy_85|><|dummy_85|><|dummy_85|><|dummy_85|><|dummy_85|><|dummy_85|><|dummy_85|><|dummy_85|><|dummy_85|><|dummy_85|><|dummy_85|><|dummy_85|><|dummy_85|><|dummy_85|><|dummy_85|><|dummy_85|><|dummy_85|><|dummy_85|><|dummy_85|><|dummy_85|><|dummy_85|>"
prehistory,Genetic evidence from the oldest known human skeletons in the New World dating from no more than __________ years ago indicate close connections between _________.,"13,000; the skeletal remains of the first Americans, Native Americans, and the ancient and modern inhabitants of Siberia.","Genetic evidence from the oldest known human skeletons in the New World dating from no more than 15,000 years ago indicate close connections between Native Americans and ancient Siberian populations.<|dummy_85|><|dummy_85|><|dummy_85|><|dummy_85|><|dummy_85|><|dummy_85|><|dummy_85|><|dummy_85|><|dummy_85|><|dummy_85|><|dummy_85|><|dummy_85|><|dummy_85|><|dummy_85|><|dummy_85|><|dummy_85|><|dummy_85|><|dummy_85|><|dummy_85|><|dummy_85|><|dummy_85|><|dummy_85|><|dummy_85|><|dummy_85|><|dummy_85|><|dummy_85|><|dummy_85|>"
world_religions,What genre of Sikh literature is denoted by the term janam-sakhis?,Birth narratives,Biographical narratives of Guru Nanak's life.<|dummy_85|><|dummy_85|><|dummy_85|><|dummy_85|><|dummy_85|><|dummy_85|><|dummy_85|><|dummy_85|><|dummy_85|><|dummy_85|><|dummy_85|><|dummy_85|><|dummy_85|><|dummy_85|><|dummy_85|><|dummy_85|><|dummy_85|><|dummy_85|><|dummy_85|><|dummy_85|><|dummy_85|><|dummy_85|><|dummy_85|><|dummy_85|><|dummy_85|><|dummy_85|><|dummy_85|><|dummy_85|><|dummy_85|><|dummy_85|><|dummy_85|><|dummy_85|><|dummy_85|><|dummy_85|><|dummy_85|><|dummy_85|><|dummy_85|><|dummy_85|><|dummy_85|><|dummy_85|><|dummy_85|><|dummy_85|><|dummy_85|><|dummy_85|><|dummy_85|><|dummy_85|><|dummy_85|><|dummy_85|><|dummy_85|><|dummy_85|><|dummy_85|><|dummy_85|><|dummy_85|>
high_school_geography,The construction of freeways leads to all but which of the following results?,Decreased dependency on cars,The construction of freeways leads to all but reduced urban sprawl.<|dummy_85|><|dummy_85|><|dummy_85|><|dummy_85|><|dummy_85|><|dummy_85|><|dummy_85|><|dummy_85|><|dummy_85|><|dummy_85|><|dummy_85|><|dummy_85|><|dummy_85|><|dummy_85|><|dummy_85|><|dummy_85|><|dummy_85|><|dummy_85|><|dummy_85|><|dummy_85|><|dummy_85|><|dummy_85|><|dummy_85|><|dummy_85|><|dummy_85|><|dummy_85|><|dummy_85|><|dummy_85|><|dummy_85|><|dummy_85|><|dummy_85|><|dummy_85|><|dummy_85|><|dummy_85|><|dummy_85|><|dummy_85|><|dummy_85|><|dummy_85|><|dummy_85|><|dummy_85|><|dummy_85|><|dummy_85|><|dummy_85|><|dummy_85|><|dummy_85|><|dummy_85|><|dummy_85|><|dummy_85|><|dummy_85|>
electrical_engineering,"What will be the number of lamps, each having 300 lumens, required to obtain an average illuminance of 50 lux on a 4m * 3m rectangular room?",2,"12 lamps. 

(Explanation: Total lumens needed = 50 lux × 12 m² = 600 lumens. Number of lamps = 600 lumens / 300 lumens per lamp = 2 lamps. However, considering uniform distribution and practical setup, typically 12 lamps are used to ensure even"
computer_security,Applications developed by programming languages like ____ and ______ have this common buffer-overflow error.,"C, C++",C and C++.<|dummy_85|><|dummy_85|><|dummy_85|><|dummy_85|><|dummy_85|><|dummy_85|><|dummy_85|><|dummy_85|><|dummy_85|><|dummy_85|><|dummy_85|><|dummy_85|><|dummy_85|><|dummy_85|><|dummy_85|><|dummy_85|><|dummy_85|><|dummy_85|><|dummy_85|><|dummy_85|><|dummy_85|><|dummy_85|><|dummy_85|><|dummy_85|><|dummy_85|><|dummy_85|><|dummy_85|><|dummy_85|><|dummy_85|><|dummy_85|><|dummy_85|><|dummy_85|><|dummy_85|><|dummy_85|><|dummy_85|><|dummy_85|><|dummy_85|><|dummy_85|><|dummy_85|><|dummy_85|><|dummy_85|><|dummy_85|><|dummy_85|><|dummy_85|><|dummy_85|><|dummy_85|><|dummy_85|><|dummy_85|><|dummy_85|><|dummy_85|><|dummy_85|><|dummy_85|><|dummy_85|><|dummy_85|><|dummy_85|><|dummy_85|><|dummy_85|><|dummy_85|><|dummy_85|>
electrical_engineering,The smallest change in measured variable to which instrument will respond is,resolution.,The resolution of the instrument.<|dummy_85|><|dummy_85|><|dummy_85|><|dummy_85|><|dummy_85|><|dummy_85|><|dummy_85|><|dummy_85|><|dummy_85|><|dummy_85|><|dummy_85|><|dummy_85|><|dummy_85|><|dummy_85|><|dummy_85|><|dummy_85|><|dummy_85|><|dummy_85|><|dummy_85|><|dummy_85|><|dummy_85|><|dummy_85|><|dummy_85|><|dummy_85|>
high_school_geography,Which of the following situations does NOT occur in a federal state?,Central government governs country as a single unit.,"A single, centralized government making all decisions without regional autonomy.<|dummy_85|><|dummy_85|><|dummy_85|><|dummy_85|><|dummy_85|><|dummy_85|><|dummy_85|><|dummy_85|><|dummy_85|><|dummy_85|><|dummy_85|><|dummy_85|><|dummy_85|><|dummy_85|><|dummy_85|><|dummy_85|><|dummy_85|><|dummy_85|>"
computer_security,The __________ was a huge marketplace of Dark Web specifically famous for selling of illegal drugs & narcotics as well as you can find a wide range of other goods for sale.,Silk Road,Silk Road.<|dummy_85|><|dummy_85|><|dummy_85|><|dummy_85|><|dummy_85|><|dummy_85|><|dummy_85|><|dummy_85|><|dummy_85|><|dummy_85|><|dummy_85|><|dummy_85|><|dummy_85|><|dummy_85|><|dummy_85|><|dummy_85|><|dummy_85|><|dummy_85|><|dummy_85|><|dummy_85|><|dummy_85|><|dummy_85|><|dummy_85|><|dummy_85|><|dummy_85|><|dummy_85|>
abstract_algebra,"Let A and B be sets, f: A -> B and g: B -> A be functions such that for all a \in A, g(f(a)) = a. Statement 1 | The function f must necessarily be injective. Statement 2 | The function f must necessarily be surjective.","True, False",Statement 1 is true; Statement 2 is false.<|dummy_85|><|dummy_85|><|dummy_85|><|dummy_85|><|dummy_85|><|dummy_85|><|dummy_85|><|dummy_85|><|dummy_85|><|dummy_85|><|dummy_85|><|dummy_85|><|dummy_85|><|dummy_85|><|dummy_85|><|dummy_85|><|dummy_85|><|dummy_85|>
electrical_engineering,Which of the following oscillators are used for low frequency (LF) applications,RC oscillators,Hartley and Colpitts oscillators are commonly used for low frequency (LF) applications.<|dummy_85|><|dummy_85|><|dummy_85|><|dummy_85|><|dummy_85|><|dummy_85|><|dummy_85|><|dummy_85|><|dummy_85|>
international_law,When coastal States do enforce their criminal jurisdiction over foreign vessels in their ports?,Port States generally do not enforce their criminal jurisdiction over crimes that do not infringe their customs laws or disrupt peace and public order.,"Coastal States enforce their criminal jurisdiction over foreign vessels in their ports when the crime affects the coastal State, its citizens, or breaches its laws."
abstract_algebra,Find the number of elements in the indicated cyclic group: The cyclic subgroup of Z_30 generated by 25.,6,The cyclic subgroup of \( \mathbb{Z}_{30} \) generated by 25 has 6 elements.<|dummy_85|><|dummy_85|><|dummy_85|><|dummy_85|><|dummy_85|><|dummy_85|>
anatomy,"If you run your finger down the anterior midline of a patient's extended neck from chin to sternal notch, you should be able to palpate, in order, the","hyoid bone, thyroid cartilage, cricoid cartilage.","chin, hyoid bone, thyroid cartilage, cricoid cartilage, and suprasternal notch.<|dummy_85|><|dummy_85|><|dummy_85|><|dummy_85|><|dummy_85|><|dummy_85|><|dummy_85|>"
marketing,What type of media has the primary objective to get the attention of shoppers and to stimulate them to make a purchase? (Examples include point-of-purchase displays and packaging.),In-store media.,Retail media.<|dummy_85|><|dummy_85|><|dummy_85|><|dummy_85|><|dummy_85|><|dummy_85|><|dummy_85|><|dummy_85|><|dummy_85|><|dummy_85|><|dummy_85|><|dummy_85|><|dummy_85|><|dummy_85|><|dummy_85|><|dummy_85|><|dummy_85|><|dummy_85|><|dummy_85|><|dummy_85|><|dummy_85|><|dummy_85|><|dummy_85|><|dummy_85|><|dummy_85|><|dummy_85|><|dummy_85|><|dummy_85|><|dummy_85|><|dummy_85|><|dummy_85|><|dummy_85|><|dummy_85|>
international_law,Are there any limits to the application of article 103 of the UN Charter?,"Yes, article 103 of the UN Charter cannot trump jus cogens norms","Article 103 of the UN Charter prioritizes obligations under the Charter over other international agreements, but its application is limited to conflicts between Charter obligations and other treaty obligations.<|dummy_85|><|dummy_85|><|dummy_85|>"
prehistory,Pompeii was unusually well preserved because:,the layer of volcanic pumice created a seal over the remains.,It was buried rapidly by volcanic ash from Mount Vesuvius in 79 AD.<|dummy_85|><|dummy_85|><|dummy_85|><|dummy_85|><|dummy_85|><|dummy_85|><|dummy_85|><|dummy_85|><|dummy_85|><|dummy_85|><|dummy_85|><|dummy_85|><|dummy_85|><|dummy_85|><|dummy_85|><|dummy_85|><|dummy_85|><|dummy_85|><|dummy_85|>
abstract_algebra,Statement 1 | If a finite group has order n then the group contains a subgroup of order d for every positive divisor d of n. Statement 2 | If a belongs to a finite group then |a| divides |G|.,"False, True","Both statements are true. Statement 1 is a consequence of Cauchy's and Sylow's theorems, and Statement 2 follows from Lagrange's theorem."
high_school_geography,Which one of the following is NOT a characteristic of world cities?,World cities are found only in the northern and western hemispheres.,Lack of global economic influence.<|dummy_85|><|dummy_85|><|dummy_85|><|dummy_85|><|dummy_85|><|dummy_85|><|dummy_85|><|dummy_85|><|dummy_85|><|dummy_85|><|dummy_85|><|dummy_85|><|dummy_85|><|dummy_85|><|dummy_85|><|dummy_85|><|dummy_85|><|dummy_85|><|dummy_85|><|dummy_85|><|dummy_85|><|dummy_85|><|dummy_85|><|dummy_85|><|dummy_85|><|dummy_85|><|dummy_85|><|dummy_85|><|dummy_85|>
anatomy,A lesion causing compression of the facial nerve at the stylomastoid foramen will cause ipsilateral,paralysis of the facial muscles.,facial paralysis.<|dummy_85|><|dummy_85|><|dummy_85|><|dummy_85|><|dummy_85|><|dummy_85|><|dummy_85|><|dummy_85|><|dummy_85|><|dummy_85|><|dummy_85|><|dummy_85|><|dummy_85|><|dummy_85|><|dummy_85|><|dummy_85|><|dummy_85|><|dummy_85|><|dummy_85|><|dummy_85|><|dummy_85|><|dummy_85|><|dummy_85|><|dummy_85|><|dummy_85|><|dummy_85|><|dummy_85|><|dummy_85|><|dummy_85|><|dummy_85|><|dummy_85|><|dummy_85|>
high_school_geography,Which continent has the highest total fertility rates?,Africa,Africa.<|dummy_85|><|dummy_85|><|dummy_85|><|dummy_85|><|dummy_85|><|dummy_85|><|dummy_85|><|dummy_85|><|dummy_85|><|dummy_85|><|dummy_85|><|dummy_85|><|dummy_85|><|dummy_85|><|dummy_85|><|dummy_85|><|dummy_85|><|dummy_85|><|dummy_85|><|dummy_85|><|dummy_85|><|dummy_85|><|dummy_85|><|dummy_85|><|dummy_85|><|dummy_85|><|dummy_85|><|dummy_85|><|dummy_85|><|dummy_85|><|dummy_85|><|dummy_85|><|dummy_85|><|dummy_85|>
marketing,The purpose of evaluating the attractiveness of the differing market segments identified in the second stage of the market segmentation process is to:,Evaluate the market potential within each segment.,Select the most viable segments for targeting based on potential profitability and alignment with company goals.<|dummy_85|><|dummy_85|><|dummy_85|><|dummy_85|><|dummy_85|><|dummy_85|><|dummy_85|><|dummy_85|><|dummy_85|><|dummy_85|><|dummy_85|><|dummy_85|><|dummy_85|><|dummy_85|><|dummy_85|><|dummy_85|><|dummy_85|><|dummy_85|><|dummy_85|>
world_religions,The title Dalai Lama means which of the following?,Ocean of Wisdom,"""Ocean of Wisdom.""<|dummy_85|><|dummy_85|><|dummy_85|><|dummy_85|><|dummy_85|><|dummy_85|><|dummy_85|><|dummy_85|><|dummy_85|><|dummy_85|><|dummy_85|><|dummy_85|><|dummy_85|><|dummy_85|><|dummy_85|><|dummy_85|><|dummy_85|><|dummy_85|><|dummy_85|><|dummy_85|><|dummy_85|><|dummy_85|><|dummy_85|><|dummy_85|><|dummy_85|><|dummy_85|><|dummy_85|><|dummy_85|><|dummy_85|><|dummy_85|><|dummy_85|><|dummy_85|><|dummy_85|><|dummy_85|><|dummy_85|><|dummy_85|>"
electrical_engineering,Which of the following is not a sinusoidal oscillator?,Relaxation oscillator,"A non-sinusoidal oscillator, such as a square wave or sawtooth wave oscillator, is not a sinusoidal oscillator.<|dummy_85|><|dummy_85|><|dummy_85|><|dummy_85|><|dummy_85|><|dummy_85|><|dummy_85|><|dummy_85|><|dummy_85|><|dummy_85|><|dummy_85|><|dummy_85|><|dummy_85|><|dummy_85|><|dummy_85|>"
prehistory,"The royal graves of the Shang Dynasty consisted of enormous cruciform-shaped tombs, where the deceased kings were buried with:",all of the above.,"Numerous valuable artifacts, human and animal sacrifices, and bronze vessels.<|dummy_85|><|dummy_85|><|dummy_85|><|dummy_85|><|dummy_85|><|dummy_85|><|dummy_85|><|dummy_85|><|dummy_85|><|dummy_85|><|dummy_85|><|dummy_85|><|dummy_85|><|dummy_85|><|dummy_85|><|dummy_85|><|dummy_85|><|dummy_85|><|dummy_85|><|dummy_85|><|dummy_85|><|dummy_85|><|dummy_85|><|dummy_85|><|dummy_85|><|dummy_85|><|dummy_85|>"
marketing,These store goods for moderate to long periods:,Storage warehouses.,Warehouses.<|dummy_85|><|dummy_85|><|dummy_85|><|dummy_85|><|dummy_85|><|dummy_85|><|dummy_85|><|dummy_85|><|dummy_85|><|dummy_85|><|dummy_85|><|dummy_85|><|dummy_85|><|dummy_85|><|dummy_85|><|dummy_85|><|dummy_85|><|dummy_85|><|dummy_85|><|dummy_85|><|dummy_85|><|dummy_85|><|dummy_85|><|dummy_85|><|dummy_85|><|dummy_85|><|dummy_85|><|dummy_85|><|dummy_85|><|dummy_85|><|dummy_85|><|dummy_85|><|dummy_85|><|dummy_85|><|dummy_85|><|dummy_85|><|dummy_85|><|dummy_85|>
abstract_algebra,Statement 1 | Every quotient ring of every commutative ring is again a commutative ring. Statement 2 | An ideal N in a ring R with unity 1 is all of R if and only if 1 in N.,"True, False",Both statements are true.<|dummy_85|><|dummy_85|><|dummy_85|><|dummy_85|><|dummy_85|><|dummy_85|><|dummy_85|><|dummy_85|><|dummy_85|><|dummy_85|><|dummy_85|><|dummy_85|><|dummy_85|><|dummy_85|><|dummy_85|><|dummy_85|><|dummy_85|><|dummy_85|><|dummy_85|><|dummy_85|><|dummy_85|><|dummy_85|><|dummy_85|><|dummy_85|><|dummy_85|><|dummy_85|><|dummy_85|><|dummy_85|><|dummy_85|><|dummy_85|><|dummy_85|><|dummy_85|><|dummy_85|><|dummy_85|><|dummy_85|><|dummy_85|>
